Review Title,Review Description,Review Rating,Sentiment,Review,scores,compound,SIA_sentiment_type
really worth price,room comfortable cosy clean hotel convenient location min walk away bugis junction rochor mrt also many food options around like fortune center ginett degrees sunshine plaza tried chicken wings onion rings degrees sumptuous one staff would like highlight hema friendly accommodating throughout really good customer service overall great enjoyable time,5,2,really worth priceroom comfortable cosy clean hotel convenient location min walk away bugis junction rochor mrt also many food options around like fortune center ginett degrees sunshine plaza tried chicken wings onion rings degrees sumptuous one staff would like highlight hema friendly accommodating throughout really good customer service overall great enjoyable time,"{'neg': 0.0, 'neu': 0.558, 'pos': 0.442, 'compound': 0.9841}",0.9841,2
excellent service great location,hotel easy identify bar burger joint level check process smooth quick excellent service duty manager daryl professional friendly room clean aesthetically pleasing slightly small lots good food malls around,5,2,excellent service great locationhotel easy identify bar burger joint level check process smooth quick excellent service duty manager daryl professional friendly room clean aesthetically pleasing slightly small lots good food malls around,"{'neg': 0.0, 'neu': 0.477, 'pos': 0.523, 'compound': 0.9784}",0.9784,2
review hotel g,room good environment really one kind stay good actually thought going really super modern vibe going air con strong rain shower good wished food services fridge room complementarity shared fridge lobby label store item also bathtub stay good service top notch especially one staff daryl goh really made super good impression mind type service hotel follow staff good remember names hotel good place go give try,5,2,review hotel groom good environment really one kind stay good actually thought going really super modern vibe going air con strong rain shower good wished food services fridge room complementarity shared fridge lobby label store item also bathtub stay good service top notch especially one staff daryl goh really made super good impression mind type service hotel follow staff good remember names hotel good place go give try,"{'neg': 0.0, 'neu': 0.553, 'pos': 0.447, 'compound': 0.9905}",0.9905,2
hotel g singapore great hotel great staff great service,stayed singapore days hotel g entire trip convenient location surrounded museums art schools rich culture hotel economic service excellent thank bobby front desk constant hospitality,5,2,hotel g singapore great hotel great staff great servicestayed singapore days hotel g entire trip convenient location surrounded museums art schools rich culture hotel economic service excellent thank bobby front desk constant hospitality,"{'neg': 0.0, 'neu': 0.531, 'pos': 0.469, 'compound': 0.9723}",0.9723,2
staycation,though room small without fridge still convenient deposit drinks fruits front desk secured common fridge would like commend yvonne ng office manager good communication skills abilities attend individual guest needs warm passionate caring graceful attentive patient alert soft spoken possess professional integrity courteous greetings positive friendly attitude would definitely wanna come back many enjoyable staycations especially enjoy rain shower bathroom thumbs yvonne hotel g,5,2,staycationthough room small without fridge still convenient deposit drinks fruits front desk secured common fridge would like commend yvonne ng office manager good communication skills abilities attend individual guest needs warm passionate caring graceful attentive patient alert soft spoken possess professional integrity courteous greetings positive friendly attitude would definitely wanna come back many enjoyable staycations especially enjoy rain shower bathroom thumbs yvonne hotel g,"{'neg': 0.0, 'neu': 0.467, 'pos': 0.533, 'compound': 0.9933}",0.9933,2
nice stay even longer period,location good bugis orchard road walking distance staffs service desk helpful friendly size room big really everything need stay hotel g singapore next time visit singapore bugis,4,2,nice stay even longer periodlocation good bugis orchard road walking distance staffs service desk helpful friendly size room big really everything need stay hotel g singapore next time visit singapore bugis,"{'neg': 0.0, 'neu': 0.69, 'pos': 0.31, 'compound': 0.8934}",0.8934,2
relaxing staycation city,pleasant experience check check everything seamless receptionist daryl courteous friendly last least would like say word thanks front office managers howard bobby assisting make stay pleasant ones definitely recommend hotel back,5,2,relaxing staycation citypleasant experience check check everything seamless receptionist daryl courteous friendly last least would like say word thanks front office managers howard bobby assisting make stay pleasant ones definitely recommend hotel back,"{'neg': 0.0, 'neu': 0.514, 'pos': 0.486, 'compound': 0.9705}",0.9705,2
great hotel great services,shout duty manager daryl bobby great hospitality stay absolutely amazing providing services rest team well location convenient walking distance mrt bus stations ntuc lot good foods around area room clean tidy great room good couple stay highly recommend try hotel definitely visit,5,2,great hotel great servicesshout duty manager daryl bobby great hospitality stay absolutely amazing providing services rest team well location convenient walking distance mrt bus stations ntuc lot good foods around area room clean tidy great room good couple stay highly recommend try hotel definitely visit,"{'neg': 0.0, 'neu': 0.482, 'pos': 0.518, 'compound': 0.9887}",0.9887,2
high accessible good location,hotel situated convenient place assisted bella check professional efficient upon arrival great king room booked surprised welcome decorations team put effort thank recommendation add little bit extra surprise last least would also like thank daryl mita swift assistance requests stay,5,2,high accessible good locationhotel situated convenient place assisted bella check professional efficient upon arrival great king room booked surprised welcome decorations team put effort thank recommendation add little bit extra surprise last least would also like thank daryl mita swift assistance requests stay,"{'neg': 0.0, 'neu': 0.561, 'pos': 0.439, 'compound': 0.9714}",0.9714,2
pleasant affordable wonderful service,staycation twice solo partner enjoyed stays tremendously location ideal terms accessibility food room clean bed comfortable would like give shout daryl duty manager lucky checked twice always friendly helpful second stay upgraded room high floor would like thank call centre well following informed tv called back offered room change immediately cheers cannot wait next stay,5,2,pleasant affordable wonderful servicestaycation twice solo partner enjoyed stays tremendously location ideal terms accessibility food room clean bed comfortable would like give shout daryl duty manager lucky checked twice always friendly helpful second stay upgraded room high floor would like thank call centre well following informed tv called back offered room change immediately cheers cannot wait next stay,"{'neg': 0.0, 'neu': 0.515, 'pos': 0.485, 'compound': 0.9902}",0.9902,2
cosy great,check bella great room king booked check process fast furious great king room booked nice couple two person space nice thank hotel g team hospitality recommend friends sure special thanks front desk staff took us since day one daryl hema howard yvonne course bella,5,2,cosy greatcheck bella great room king booked check process fast furious great king room booked nice couple two person space nice thank hotel g team hospitality recommend friends sure special thanks front desk staff took us since day one daryl hema howard yvonne course bella,"{'neg': 0.056, 'neu': 0.496, 'pos': 0.448, 'compound': 0.9753}",0.9753,2
really friendly helpful staffs,got free upgrade stay love amenities provided location splendid well nearby good food places appreciate staffs extremely friendly super helpful would definitely come back,5,2,really friendly helpful staffsgot free upgrade stay love amenities provided location splendid well nearby good food places appreciate staffs extremely friendly super helpful would definitely come back,"{'neg': 0.0, 'neu': 0.278, 'pos': 0.722, 'compound': 0.9899}",0.9899,2
good stay,hotel conveniently located booked good room queen unique design comfortable importantly hotel staff excellent willing help looked happy serve friendly service special shout ana daryl bella counter checked definitely return another staycation family,5,2,good stayhotel conveniently located booked good room queen unique design comfortable importantly hotel staff excellent willing help looked happy serve friendly service special shout ana daryl bella counter checked definitely return another staycation family,"{'neg': 0.0, 'neu': 0.444, 'pos': 0.556, 'compound': 0.9819}",0.9819,2
hotel g,hotel g gives u unique experience affordable price pleasant meeting daryl manager duty cheerful forthcoming relaxing sitting degree either sipping coffee meal u watch world go,5,2,hotel ghotel g gives u unique experience affordable price pleasant meeting daryl manager duty cheerful forthcoming relaxing sitting degree either sipping coffee meal u watch world go,"{'neg': 0.0, 'neu': 0.677, 'pos': 0.323, 'compound': 0.875}",0.875,2
great first time stay,booked good king room room clean cozy room complete hair dryer boxes water handled bobby hana happy attentiveness provided thank,5,2,great first time staybooked good king room room clean cozy room complete hair dryer boxes water handled bobby hana happy attentiveness provided thank,"{'neg': 0.0, 'neu': 0.531, 'pos': 0.469, 'compound': 0.9423}",0.9423,2
small hotel big hearts,look hotel g one best hotels use srv vouchers basic package need fork cash top e spend cash good food rooms small service great rooms small sqm feel suffocated said bigger rooms stayed hotels sg overseas rooms nicely uniquely designed unlike many business hotels generic rooms mattress use serta nice sleep though pillow tad tough flat also air con temperature wind speed adjustable hooray note big luggage bit squeezy however mote point since,5,2,small hotel big heartslook hotel g one best hotels use srv vouchers basic package need fork cash top e spend cash good food rooms small service great rooms small sqm feel suffocated said bigger rooms stayed hotels sg overseas rooms nicely uniquely designed unlike many business hotels generic rooms mattress use serta nice sleep though pillow tad tough flat also air con temperature wind speed adjustable hooray note big luggage bit squeezy however mote point since,"{'neg': 0.017, 'neu': 0.737, 'pos': 0.246, 'compound': 0.9661}",0.9661,2
short stayaction good room single,book good room single experience booked thru hotel official website get email attractive offers surprised see biggest room offered price room included list room available booking day however decided skip f b offers like burger bed tempting snacks like chicken wings ice cream tubes need watch diet day check check effortless complimentary check offered went storey check single room hotel g good applying common sense maximising space work desk kettle cup container coffee tea placed wall holder good create bigger place,4,2,short stayaction good room singlebook good room single experience booked thru hotel official website get email attractive offers surprised see biggest room offered price room included list room available booking day however decided skip f b offers like burger bed tempting snacks like chicken wings ice cream tubes need watch diet day check check effortless complimentary check offered went storey check single room hotel g good applying common sense maximising space work desk kettle cup container coffee tea placed wall holder good create bigger place,"{'neg': 0.0, 'neu': 0.732, 'pos': 0.268, 'compound': 0.9732}",0.9732,2
excellent staycation cosy hotel,using srv redeem good deal hotel g check fast smooth surprised room decor upon entering little small touches hotel make stay comfortable enjoyable room small cosy clean deal comes ginette restaurant worth thanks howard bobby made stay enjoyable highly recommended,5,2,excellent staycation cosy hotelusing srv redeem good deal hotel g check fast smooth surprised room decor upon entering little small touches hotel make stay comfortable enjoyable room small cosy clean deal comes ginette restaurant worth thanks howard bobby made stay enjoyable highly recommended,"{'neg': 0.0, 'neu': 0.541, 'pos': 0.459, 'compound': 0.9756}",0.9756,2
n staycation,initially booked good queen room n stay partner anniversary celebration n love location hotel amenities decided extend stay additional night upon extension daryl actually gave us complimentary upgrade great king room partner shocked happy time strongly recommend hotel g location convenient almost everywhere food commendable well last least staff friendly approachable includes daryl bella,5,2,n staycationinitially booked good queen room n stay partner anniversary celebration n love location hotel amenities decided extend stay additional night upon extension daryl actually gave us complimentary upgrade great king room partner shocked happy time strongly recommend hotel g location convenient almost everywhere food commendable well last least staff friendly approachable includes daryl bella,"{'neg': 0.032, 'neu': 0.558, 'pos': 0.41, 'compound': 0.9779}",0.9779,2
n staycay,booked good queen room night stay traveloka check timing allocated us via email pm pm queue mins check public holiday however process fast fuss free room small yet cosy clean bed really soft location hotel near multiple mrt stations nearest convenient store located bugis even though multiple across street open till night also decided extend stay night room category checked check great hospitality service daryl duty manager efficient polite throughout entire process also exceeded expectation upgrading us good king,5,2,n staycaybooked good queen room night stay traveloka check timing allocated us via email pm pm queue mins check public holiday however process fast fuss free room small yet cosy clean bed really soft location hotel near multiple mrt stations nearest convenient store located bugis even though multiple across street open till night also decided extend stay night room category checked check great hospitality service daryl duty manager efficient polite throughout entire process also exceeded expectation upgrading us good king,"{'neg': 0.0, 'neu': 0.755, 'pos': 0.245, 'compound': 0.9686}",0.9686,2
staycay,howard daryl bella hospitable went make stay enjoyable hotel clean room feel great dining vouchers handy used ginnett restaurant overall pleased stay,5,2,staycayhoward daryl bella hospitable went make stay enjoyable hotel clean room feel great dining vouchers handy used ginnett restaurant overall pleased stay,"{'neg': 0.0, 'neu': 0.588, 'pos': 0.412, 'compound': 0.9118}",0.9118,2
service,staffs daren bella helpful serving boyfriend whenever enquires room would strike conversations stay could improve better feedback given immediate action taken ensure pleasant stay room however bathroom lights tripping time even servicing lights still went next day,3,1,servicestaffs daren bella helpful serving boyfriend whenever enquires room would strike conversations stay could improve better feedback given immediate action taken ensure pleasant stay room however bathroom lights tripping time even servicing lights still went next day,"{'neg': 0.032, 'neu': 0.66, 'pos': 0.309, 'compound': 0.9186}",0.9186,2
staycation deals rediscover voucher,staycaytion using rediscover voucher worth stay came breakfast set menu also nett dining credits room relatively spacious clean money paid basic amenities room note fridge though special shout yvonne aided us check made process smooth would also like thank daryl bella well always greeting us warmly made us feel home whenever approached front office would definitely recommend coming stay hotel would back another staycay,5,2,staycation deals rediscover voucherstaycaytion using rediscover voucher worth stay came breakfast set menu also nett dining credits room relatively spacious clean money paid basic amenities room note fridge though special shout yvonne aided us check made process smooth would also like thank daryl bella well always greeting us warmly made us feel home whenever approached front office would definitely recommend coming stay hotel would back another staycay,"{'neg': 0.0, 'neu': 0.671, 'pos': 0.329, 'compound': 0.9732}",0.9732,2
like vibe hotel,location perfect well right center town next museum art school mins walk shopping entertainment district cinema library etc also near mrt station downtown line,4,2,like vibe hotellocation perfect well right center town next museum art school mins walk shopping entertainment district cinema library etc also near mrt station downtown line,"{'neg': 0.0, 'neu': 0.665, 'pos': 0.335, 'compound': 0.8779}",0.8779,2
amazing stay,amazing stay hotel special thanks howard bobby always ensure comfortable stay throughout entire stay felt welcome moment entering hotel daryl assisted us check thank,5,2,amazing stayamazing stay hotel special thanks howard bobby always ensure comfortable stay throughout entire stay felt welcome moment entering hotel daryl assisted us check thank,"{'neg': 0.0, 'neu': 0.464, 'pos': 0.536, 'compound': 0.9628}",0.9628,2
great hospitality,great stay experience hotel g location hotel great surrounded major mrt line like bencoolen rochor bugis many food options around hotel well warm greeting howard stepped hotel lobby offered us umbrella raining check process assisted daryl smooth quick professional bobby reception helpful patience assist questions enquires room interior design cosy makes us feel comfortable even room size bit small make reservation earlier wish dine ginett always fully book also miss deals beers sides pm pm degrees burger wine liquor bar well price,5,2,great hospitalitygreat stay experience hotel g location hotel great surrounded major mrt line like bencoolen rochor bugis many food options around hotel well warm greeting howard stepped hotel lobby offered us umbrella raining check process assisted daryl smooth quick professional bobby reception helpful patience assist questions enquires room interior design cosy makes us feel comfortable even room size bit small make reservation earlier wish dine ginett always fully book also miss deals beers sides pm pm degrees burger wine liquor bar well price,"{'neg': 0.018, 'neu': 0.692, 'pos': 0.29, 'compound': 0.9762}",0.9762,2
honeymoon,compact room comfortable bed sleep location convinient love turkish food nearby hotel entrance staff main entrance near restaurant friendly check fast,5,2,honeymooncompact room comfortable bed sleep location convinient love turkish food nearby hotel entrance staff main entrance near restaurant friendly check fast,"{'neg': 0.0, 'neu': 0.627, 'pos': 0.373, 'compound': 0.8934}",0.8934,2
relaxing,check smooth even pm room great sized made things great cleanliness fast express checkout nothing seems missed like thank bobby warm welcome,5,2,relaxingcheck smooth even pm room great sized made things great cleanliness fast express checkout nothing seems missed like thank bobby warm welcome,"{'neg': 0.061, 'neu': 0.434, 'pos': 0.505, 'compound': 0.9369}",0.9369,2
exemplary customer service,thoroughly impressed professional customer service provided daryl check service providing ice room personally even long snaking queue check daryl went beyond maintaining professional attitude would totally come back service provided rooms clean comfortable customer service exceeded expectations even better star hotels singapore,5,2,exemplary customer servicethoroughly impressed professional customer service provided daryl check service providing ice room personally even long snaking queue check daryl went beyond maintaining professional attitude would totally come back service provided rooms clean comfortable customer service exceeded expectations even better star hotels singapore,"{'neg': 0.0, 'neu': 0.769, 'pos': 0.231, 'compound': 0.9001}",0.9001,2
great staycation,always great choice staycation second time still happy professional swift help special mentions daryl shaun bobby awesome service getting room ready us short notice,5,2,great staycationalways great choice staycation second time still happy professional swift help special mentions daryl shaun bobby awesome service getting room ready us short notice,"{'neg': 0.0, 'neu': 0.398, 'pos': 0.602, 'compound': 0.9769}",0.9769,2
professional services,really enjoy comfortable vibes hotel staff friendly caring staff second time disappointed one bit big shout daryl shawn bobby awesome service guys,5,2,professional servicesreally enjoy comfortable vibes hotel staff friendly caring staff second time disappointed one bit big shout daryl shawn bobby awesome service guys,"{'neg': 0.084, 'neu': 0.458, 'pos': 0.458, 'compound': 0.9313}",0.9313,2
good staycation,tbh find room small stayed smaller ok sg standards space priced premium room cleverly designed maximize space allowing feel cozy without feeling claustrophobic space bed luggage enough room small table working travellers rooms feel quite well maintained checkin fast efficient many food options area would stay,5,2,good staycationtbh find room small stayed smaller ok sg standards space priced premium room cleverly designed maximize space allowing feel cozy without feeling claustrophobic space bed luggage enough room small table working travellers rooms feel quite well maintained checkin fast efficient many food options area would stay,"{'neg': 0.024, 'neu': 0.733, 'pos': 0.243, 'compound': 0.9047}",0.9047,2
comfortable thank,fussy commenting like g hotel overall good customer service check receptionist good helpful comfortable clean hotel thank thank thank,5,2,comfortable thankfussy commenting like g hotel overall good customer service check receptionist good helpful comfortable clean hotel thank thank thank,"{'neg': 0.0, 'neu': 0.244, 'pos': 0.756, 'compound': 0.9774}",0.9774,2
manager,stay singapore several days go united states good impression singapore efficient clerks government officials good drivers hotel steps nice trip,5,2,managerstay singapore several days go united states good impression singapore efficient clerks government officials good drivers hotel steps nice trip,"{'neg': 0.0, 'neu': 0.465, 'pos': 0.535, 'compound': 0.9337}",0.9337,2
good stay,enjoyed stay good location helpful reception staff bobby assisted directions around hotel want come back beautiful country recommend family stay,5,2,good stayenjoyed stay good location helpful reception staff bobby assisted directions around hotel want come back beautiful country recommend family stay,"{'neg': 0.0, 'neu': 0.479, 'pos': 0.521, 'compound': 0.936}",0.936,2
awesome,good stay love ambience service quick well good food nearby upgraded good room king friendly staff help possible issue,5,2,awesomegood stay love ambience service quick well good food nearby upgraded good room king friendly staff help possible issue,"{'neg': 0.0, 'neu': 0.419, 'pos': 0.581, 'compound': 0.9517}",0.9517,2
superb service,myy first time love interior superb bella helpful patience w many months staycation todayy st staycayy w fiance tend abit lost clumsy wass place w help team love concept room ecspeciallyy pinboard looks cool basicallyy love everything bella thankyou service thumbs prollyy come back kudos team,5,2,superb servicemyy first time love interior superb bella helpful patience w many months staycation todayy st staycayy w fiance tend abit lost clumsy wass place w help team love concept room ecspeciallyy pinboard looks cool basicallyy love everything bella thankyou service thumbs prollyy come back kudos team,"{'neg': 0.034, 'neu': 0.499, 'pos': 0.468, 'compound': 0.9843}",0.9843,2
friendly staff great stay,great stay experience friends hotel g despite immobility staff paid extra attention stay checking staffs friendly hospitable special thanks daryl ana hema yvonne taking care friends would definitely revisit,5,2,friendly staff great staygreat stay experience friends hotel g despite immobility staff paid extra attention stay checking staffs friendly hospitable special thanks daryl ana hema yvonne taking care friends would definitely revisit,"{'neg': 0.0, 'neu': 0.438, 'pos': 0.562, 'compound': 0.9803}",0.9803,2
great experience,great time friends hotel g staff friendly patient would like thank daryl ana hema yvonne making stay memorable one accommodating requests,5,2,great experiencegreat time friends hotel g staff friendly patient would like thank daryl ana hema yvonne making stay memorable one accommodating requests,"{'neg': 0.0, 'neu': 0.51, 'pos': 0.49, 'compound': 0.9371}",0.9371,2
customer service first,overnight getaway parents hotel g aesthetic modern feel rooms enjoyed overall guest experience special thanks shyidah shawn kiren rave ginett dining place grateful heartfelt service,5,2,customer service firstovernight getaway parents hotel g aesthetic modern feel rooms enjoyed overall guest experience special thanks shyidah shawn kiren rave ginett dining place grateful heartfelt service,"{'neg': 0.0, 'neu': 0.577, 'pos': 0.423, 'compound': 0.9371}",0.9371,2
great stay,special thanks daryl ana hema yvonne making stay enjoyable went extra mile friends special requests accommodating friendly professional,5,2,great stayspecial thanks daryl ana hema yvonne making stay enjoyable went extra mile friends special requests accommodating friendly professional,"{'neg': 0.0, 'neu': 0.408, 'pos': 0.592, 'compound': 0.9578}",0.9578,2
