Review Title,Review Description,Review Rating,Sentiment,Review,scores,compound,SIA_sentiment_type
nice,staff attentive whole place super clean comfortable issue storage space hard week stay people amd get creative liveable space,4,2,nicestaff attentive whole place super clean comfortable issue storage space hard week stay people amd get creative liveable space,"{'neg': 0.05, 'neu': 0.496, 'pos': 0.454, 'compound': 0.9081}",0.9081,2
functional efficient,good location two mrt stations within walking distance good working desk already knew room size small size issue prob could done power charging points one room,5,2,functional efficientgood location two mrt stations within walking distance good working desk already knew room size small size issue prob could done power charging points one room,"{'neg': 0.0, 'neu': 0.9, 'pos': 0.1, 'compound': 0.4404}",0.4404,2
helpfull staff good location,good location excelent breakfast staff helpfull aisha reception even took trouble help us find train station advise us visit two day break room small clean facilities required,4,2,helpfull staff good locationgood location excelent breakfast staff helpfull aisha reception even took trouble help us find train station advise us visit two day break room small clean facilities required,"{'neg': 0.073, 'neu': 0.703, 'pos': 0.224, 'compound': 0.6808}",0.6808,2
good place visit,size room right clean also staff kind cleans every day stay one week feel comfortable hope rest stays thanks,5,2,good place visitsize room right clean also staff kind cleans every day stay one week feel comfortable hope rest stays thanks,"{'neg': 0.0, 'neu': 0.453, 'pos': 0.547, 'compound': 0.9524}",0.9524,2
singapore expensive hotel g probably good gets budget end market,good location close bugis minute walk little india metres mrt entrance bencoolen st check staff helpful interesting decor call funky industrial rooms numbers floor unusually long skinny maybe metres long metres wide initial wtf find works quite well avoid rooms small cramped double rooms even smaller cramped single everything clean shower hot bed good fridges ice bucket available bar downstairs,4,2,singapore expensive hotel g probably good gets budget end marketgood location close bugis minute walk little india metres mrt entrance bencoolen st check staff helpful interesting decor call funky industrial rooms numbers floor unusually long skinny maybe metres long metres wide initial wtf find works quite well avoid rooms small cramped double rooms even smaller cramped single everything clean shower hot bed good fridges ice bucket available bar downstairs,"{'neg': 0.092, 'neu': 0.71, 'pos': 0.197, 'compound': 0.8278}",0.8278,2
would recommend,far good nana great job checking us early getting us room long flight clean modern hotel good part town would recommend solo couple travellers maybe bit small families depending room,5,2,would recommendfar good nana great job checking us early getting us room long flight clean modern hotel good part town would recommend solo couple travellers maybe bit small families depending room,"{'neg': 0.0, 'neu': 0.633, 'pos': 0.367, 'compound': 0.9337}",0.9337,2
good location,good location walking distance bugis plaza singapura full local hawker centre restaurants around area good foodies hunt local food rooms small clean front desk staff friendly overall one best location stayed singapore hotels rooms improvement,3,1,good locationgood location walking distance bugis plaza singapura full local hawker centre restaurants around area good foodies hunt local food rooms small clean front desk staff friendly overall one best location stayed singapore hotels rooms improvement,"{'neg': 0.0, 'neu': 0.613, 'pos': 0.387, 'compound': 0.9578}",0.9578,2
great hotel service near bugis also mrt,hotel great staff polite helpful clearly explained details clean room interior nice breakfast great staying night near business district would come back sure,5,2,great hotel service near bugis also mrthotel great staff polite helpful clearly explained details clean room interior nice breakfast great staying night near business district would come back sure,"{'neg': 0.0, 'neu': 0.451, 'pos': 0.549, 'compound': 0.9766}",0.9766,2
comfy great location clean,excellent stay hotel g people complain small room size hey singapore everything tidy clean outstanding service front desk staff especially matthew convenient location good restaurants around corner tasty paratas great thai food great degrees hamburgers succulent steak ricain ginett discount hotel guests ginett degrees,4,2,comfy great location cleanexcellent stay hotel g people complain small room size hey singapore everything tidy clean outstanding service front desk staff especially matthew convenient location good restaurants around corner tasty paratas great thai food great degrees hamburgers succulent steak ricain ginett discount hotel guests ginett degrees,"{'neg': 0.039, 'neu': 0.615, 'pos': 0.345, 'compound': 0.9657}",0.9657,2
comfortable clean rooms,really enjoyed staying hotel g room small comfy clean view marina bay hotel wifi worked great good location metro nearby full respect thanks matthew helpful supportive early check allowed recommended,5,2,comfortable clean roomsreally enjoyed staying hotel g room small comfy clean view marina bay hotel wifi worked great good location metro nearby full respect thanks matthew helpful supportive early check allowed recommended,"{'neg': 0.0, 'neu': 0.386, 'pos': 0.614, 'compound': 0.9831}",0.9831,2
ginett,dined ginett family birthday celebration ambience atmosphere nice warm staff working amazing elevated dining experience attention details,5,2,ginettdined ginett family birthday celebration ambience atmosphere nice warm staff working amazing elevated dining experience attention details,"{'neg': 0.0, 'neu': 0.622, 'pos': 0.378, 'compound': 0.8176}",0.8176,2
dissapointing alternative hotel,bit hipster rundown backpackers hostel asking money level real hotel rooms interestingly decorated small management really trustwothy group left hotel early first night booked much better convenient ibis nearby,2,0,dissapointing alternative hotelbit hipster rundown backpackers hostel asking money level real hotel rooms interestingly decorated small management really trustwothy group left hotel early first night booked much better convenient ibis nearby,"{'neg': 0.0, 'neu': 0.838, 'pos': 0.162, 'compound': 0.6808}",0.6808,2
first time singapore,tristan reception nice guy room small large bed good view window everything clean tidy good location planty shopping dinning places around,5,2,first time singaporetristan reception nice guy room small large bed good view window everything clean tidy good location planty shopping dinning places around,"{'neg': 0.0, 'neu': 0.627, 'pos': 0.373, 'compound': 0.8834}",0.8834,2
pleasant stay convenient location,checked night business partner came tremendously smooth easy despite arriving past corrodors bit tight enough full sized hotel trolley pass room budget sized booked single beds toilet right budget travellers bidet quality fixtures toiletries average rainshower option location convenient block away bencoleen mrt stn blocks bugis shopping malls market popular bar downstairs neighnorhood food stalls nearby breakfast option bomb get east asian contemporary options quality espresso duty managers divine personalized attention us especially several oversized,4,2,pleasant stay convenient locationchecked night business partner came tremendously smooth easy despite arriving past corrodors bit tight enough full sized hotel trolley pass room budget sized booked single beds toilet right budget travellers bidet quality fixtures toiletries average rainshower option location convenient block away bencoleen mrt stn blocks bugis shopping malls market popular bar downstairs neighnorhood food stalls nearby breakfast option bomb get east asian contemporary options quality espresso duty managers divine personalized attention us especially several oversized,"{'neg': 0.087, 'neu': 0.773, 'pos': 0.14, 'compound': 0.7076}",0.7076,2
great location great breakfast great stay,friend really enjoyed stay hotel g found location central short walk unique neighborhoods restaurants bars shopping malls also able easily walk marina bay sands gardens bay close three four metro stops different lines making public transport really easy room sensibly laid cute touches comfy bed waterfall shower breakfast also fantastic wide range choices local international western lentil dal especially amazing staff also great especially matthew front desk made us feel welcome check,5,2,great location great breakfast great stayfriend really enjoyed stay hotel g found location central short walk unique neighborhoods restaurants bars shopping malls also able easily walk marina bay sands gardens bay close three four metro stops different lines making public transport really easy room sensibly laid cute touches comfy bed waterfall shower breakfast also fantastic wide range choices local international western lentil dal especially amazing staff also great especially matthew front desk made us feel welcome check,"{'neg': 0.015, 'neu': 0.61, 'pos': 0.375, 'compound': 0.9904}",0.9904,2
choose hotel,rooms small expected shower toilet share space literally could showers using toilet stayed number properties singapore similar price range least favorite also fond neighborhood,2,0,choose hotelrooms small expected shower toilet share space literally could showers using toilet stayed number properties singapore similar price range least favorite also fond neighborhood,"{'neg': 0.083, 'neu': 0.703, 'pos': 0.214, 'compound': 0.4442}",0.4442,2
hotel g stay great,receptionist matthew awesome helpful kind checked bags bags checked rooms early kind enough help us even though check hours room nice clean affordable definitely stay come back,5,2,hotel g stay greatreceptionist matthew awesome helpful kind checked bags bags checked rooms early kind enough help us even though check hours room nice clean affordable definitely stay come back,"{'neg': 0.0, 'neu': 0.461, 'pos': 0.539, 'compound': 0.9738}",0.9738,2
excellent service,far quite pleasant stay staff exceptionally accommodating requests special thanks kalai ziwei agreeing bring cake room surprise really appreciate definitely back highly recommend hotel,5,2,excellent servicefar quite pleasant stay staff exceptionally accommodating requests special thanks kalai ziwei agreeing bring cake room surprise really appreciate definitely back highly recommend hotel,"{'neg': 0.0, 'neu': 0.377, 'pos': 0.623, 'compound': 0.9762}",0.9762,2
breakfast recommended,location nice breakfast recommended regretted eat breakfast hotel better eat toast box near hotel sound proof hotel plays music hallway hear room annoying want sleep late,4,2,breakfast recommendedlocation nice breakfast recommended regretted eat breakfast hotel better eat toast box near hotel sound proof hotel plays music hallway hear room annoying want sleep late,"{'neg': 0.147, 'neu': 0.554, 'pos': 0.299, 'compound': 0.5423}",0.5423,2
clean convenience small hotel everything need,hotel nice area close mrt station reception staff matthew friendly helpful good service room small everything need clean chic decor best match looking nice place stay spend lot time explore city,5,2,clean convenience small hotel everything needhotel nice area close mrt station reception staff matthew friendly helpful good service room small everything need clean chic decor best match looking nice place stay spend lot time explore city,"{'neg': 0.0, 'neu': 0.508, 'pos': 0.492, 'compound': 0.9756}",0.9756,2
star hotel,although hotel offered true rooms small mine specifically double one one roomate side wall teo middle bags cannot opened time inside room sink outside bathroom wc shower together separation shower floor wc get wet breakfast level ok go minutes closing start removing food reception located nd floor,2,0,star hotelalthough hotel offered true rooms small mine specifically double one one roomate side wall teo middle bags cannot opened time inside room sink outside bathroom wc shower together separation shower floor wc get wet breakfast level ok go minutes closing start removing food reception located nd floor,"{'neg': 0.0, 'neu': 0.902, 'pos': 0.098, 'compound': 0.6124}",0.6124,2
perfect decent nonetheless,stayed hotel nights work trip room small side clean comfortable sleek functional well designed maximise limited space common areas general bit tight including car access area lobby level bigger cars might difficulties coming pickup drop staff service excellent friendly helpful welcoming breakfast provided basic decent quality hotel guests entitled discount connecting restaurant called degrees burgers hotel centrally located within close proximity eateries amenities short walk bencoolen mrt bugis area really good location probably good families work solo trips overall,4,2,perfect decent nonethelessstayed hotel nights work trip room small side clean comfortable sleek functional well designed maximise limited space common areas general bit tight including car access area lobby level bigger cars might difficulties coming pickup drop staff service excellent friendly helpful welcoming breakfast provided basic decent quality hotel guests entitled discount connecting restaurant called degrees burgers hotel centrally located within close proximity eateries amenities short walk bencoolen mrt bugis area really good location probably good families work solo trips overall,"{'neg': 0.058, 'neu': 0.622, 'pos': 0.32, 'compound': 0.9794}",0.9794,2
place return,felt like arrived youth hostel although man desk pleasant knowledge area tourist attraction room queen omg tiny room open case nowhere hang clothes shower used soaked whole room clothes felt damp unless young backpacker mind roughing give hotel wide birth plus good location breakfast,2,0,place returnfelt like arrived youth hostel although man desk pleasant knowledge area tourist attraction room queen omg tiny room open case nowhere hang clothes shower used soaked whole room clothes felt damp unless young backpacker mind roughing give hotel wide birth plus good location breakfast,"{'neg': 0.0, 'neu': 0.778, 'pos': 0.222, 'compound': 0.8934}",0.8934,2
good place stay,reception staff superb especially yvonne helpful questions requests assistance coming next time singapore good service good facilities good value money regards ian,5,2,good place stayreception staff superb especially yvonne helpful questions requests assistance coming next time singapore good service good facilities good value money regards ian,"{'neg': 0.0, 'neu': 0.445, 'pos': 0.555, 'compound': 0.9647}",0.9647,2
nice cozy room,wish space king size bed direction better concierge service e carry luggage pool expected staff courteous responsive breakfast expected,4,2,nice cozy roomwish space king size bed direction better concierge service e carry luggage pool expected staff courteous responsive breakfast expected,"{'neg': 0.0, 'neu': 0.582, 'pos': 0.418, 'compound': 0.8885}",0.8885,2
decent hotel worth money,excellent location small rooms worth money wifi also issue facilities limited even place hang clothes great king room hence desk working good wash basin outlet pipe also clogging,3,1,decent hotel worth moneyexcellent location small rooms worth money wifi also issue facilities limited even place hang clothes great king room hence desk working good wash basin outlet pipe also clogging,"{'neg': 0.049, 'neu': 0.672, 'pos': 0.279, 'compound': 0.836}",0.836,2
boutique hotel professional front desk staff,good training staff fast efficient atmosphere hotel chic decent lobby access u suitcase carry u need aware entrance front desk second floor better access taxi u carry big suitcase like decent hotel,5,2,boutique hotel professional front desk staffgood training staff fast efficient atmosphere hotel chic decent lobby access u suitcase carry u need aware entrance front desk second floor better access taxi u carry big suitcase like decent hotel,"{'neg': 0.0, 'neu': 0.718, 'pos': 0.282, 'compound': 0.8555}",0.8555,2
senior friendly,jul someone family tested positive protect elderlies house hotel turned hotel g excellent choice reception staff ms nana offered us room fitted w senior friendly amenities seat shower area grab bars toilet low bed easie movement spacious room accommodate wheelchair ms natalie kind fulfil requests get meals room time even get vegetarian meals vegetarian mr matthew ever friendly greeting us w smiles behind mask time approached counter housekeeping staff excellent prompt cleaning room great thanks staff hotel g keep wonderful service need,5,2,senior friendlyjul someone family tested positive protect elderlies house hotel turned hotel g excellent choice reception staff ms nana offered us room fitted w senior friendly amenities seat shower area grab bars toilet low bed easie movement spacious room accommodate wheelchair ms natalie kind fulfil requests get meals room time even get vegetarian meals vegetarian mr matthew ever friendly greeting us w smiles behind mask time approached counter housekeeping staff excellent prompt cleaning room great thanks staff hotel g keep wonderful service need,"{'neg': 0.019, 'neu': 0.612, 'pos': 0.369, 'compound': 0.9896}",0.9896,2
amazing stay staff,stayed hotel g singapore couple nights everything excellent manager daryl super nice providing us excellent service times staff stay location everything perfect come back sure,5,2,amazing stay staffstayed hotel g singapore couple nights everything excellent manager daryl super nice providing us excellent service times staff stay location everything perfect come back sure,"{'neg': 0.0, 'neu': 0.443, 'pos': 0.557, 'compound': 0.9747}",0.9747,2
quality service,second visit hotel darryl welcoming provided tip top hospitality friends handled requests needs attentively tried best accord given room upgrade also welcome drinks voucher ginett reservation haziqah also provided seamless easy booking kudos team hotel g,5,2,quality servicesecond visit hotel darryl welcoming provided tip top hospitality friends handled requests needs attentively tried best accord given room upgrade also welcome drinks voucher ginett reservation haziqah also provided seamless easy booking kudos team hotel g,"{'neg': 0.0, 'neu': 0.578, 'pos': 0.422, 'compound': 0.9648}",0.9648,2
stayed nights everyday breakfast,room basic long stay cleaner doesnot clean room properly glass mugs floors dirty even room service complementary stuffs room top regularly short stay one night stay probably good option breakfast varities everyday menu location wise good close bugis bencoolen mrt,3,1,stayed nights everyday breakfastroom basic long stay cleaner doesnot clean room properly glass mugs floors dirty even room service complementary stuffs room top regularly short stay one night stay probably good option breakfast varities everyday menu location wise good close bugis bencoolen mrt,"{'neg': 0.054, 'neu': 0.667, 'pos': 0.28, 'compound': 0.8807}",0.8807,2
three night couples stay,hotel perfect want explore city day spending much time accomodation clean modern nice bar reasonable wine prices ground floor also burger restaurant also seemed reasonably priced bencoolen mrt station short walk connects main mrt stations including bayfront breakfast buffet style perfect every morning faults size room made difficult even open big suitcase also lifts slow overall ideal city explorers looking somewhere rest heads night,4,2,three night couples stayhotel perfect want explore city day spending much time accomodation clean modern nice bar reasonable wine prices ground floor also burger restaurant also seemed reasonably priced bencoolen mrt station short walk connects main mrt stations including bayfront breakfast buffet style perfect every morning faults size room made difficult even open big suitcase also lifts slow overall ideal city explorers looking somewhere rest heads night,"{'neg': 0.068, 'neu': 0.718, 'pos': 0.214, 'compound': 0.9001}",0.9001,2
place like chocolate coated dog crap looks good really isnt,hotel cute tiny would never stay service average beds ok room small meters meters sleeping area wanted leave places go told get refund advised advance beware place like chocolate coated dog crap looks great outside nasty surprise look inside hope go broke jerks,1,0,place like chocolate coated dog crap looks good really isnthotel cute tiny would never stay service average beds ok room small meters meters sleeping area wanted leave places go told get refund advised advance beware place like chocolate coated dog crap looks great outside nasty surprise look inside hope go broke jerks,"{'neg': 0.198, 'neu': 0.504, 'pos': 0.298, 'compound': 0.8214}",0.8214,2
excellent stay room location,first coming g hotel interesting entrance great ambience early check pm warm staff perfect solo traveller location close mrt bus station reasonable price full amenities provided definitively come back g hotel,5,2,excellent stay room locationfirst coming g hotel interesting entrance great ambience early check pm warm staff perfect solo traveller location close mrt bus station reasonable price full amenities provided definitively come back g hotel,"{'neg': 0.0, 'neu': 0.626, 'pos': 0.374, 'compound': 0.9442}",0.9442,2
pleasant experience,overall pleasant experience given price good location easy access nearby shopping malls bed comfortable special shout pauline honesty job well done room clean neat thanks,4,2,pleasant experienceoverall pleasant experience given price good location easy access nearby shopping malls bed comfortable special shout pauline honesty job well done room clean neat thanks,"{'neg': 0.0, 'neu': 0.317, 'pos': 0.683, 'compound': 0.9839}",0.9839,2
honeymoon trip,booked nights hotel g star hotel room type queen bed back cairo arrived receptionist name hema knew honeymoon trip upgraded room type king bedroom amazing super friendly helped us lot attractions booking hotel central location next lot open restaurants supermarkets amazing experience trying lots cuisines turkish thai indian vietnamese chinese like bar couple bars corner open till late room bit small though everything clean super cozy also use restaurant pretty good affordable even didnt book food advance,4,2,honeymoon tripbooked nights hotel g star hotel room type queen bed back cairo arrived receptionist name hema knew honeymoon trip upgraded room type king bedroom amazing super friendly helped us lot attractions booking hotel central location next lot open restaurants supermarkets amazing experience trying lots cuisines turkish thai indian vietnamese chinese like bar couple bars corner open till late room bit small though everything clean super cozy also use restaurant pretty good affordable even didnt book food advance,"{'neg': 0.0, 'neu': 0.672, 'pos': 0.328, 'compound': 0.9858}",0.9858,2
friends staycation,staycation friend linger longer promo two night stay good room bundled degrees restaurant downstairs takes two box includes signature burgers side room amenities room comfy enough two petite ladies like us interesting layout sink outside toilet use fancy metis brand soaps smell good wardrobe room though hang clothes mirror entrance hangers food comment burger combo included promo package fries tasted little stale otherwise burgers pretty decent service staff super friendly accommodated,4,2,friends staycationstaycation friend linger longer promo two night stay good room bundled degrees restaurant downstairs takes two box includes signature burgers side room amenities room comfy enough two petite ladies like us interesting layout sink outside toilet use fancy metis brand soaps smell good wardrobe room though hang clothes mirror entrance hangers food comment burger combo included promo package fries tasted little stale otherwise burgers pretty decent service staff super friendly accommodated,"{'neg': 0.0, 'neu': 0.695, 'pos': 0.305, 'compound': 0.979}",0.979,2
fantastic location,stayed hotel nights th june hotel good location loads shops restaurants markets nearby ate restaurants located hotel guest discount food really good room spotless th floor room small knew arrived wasnt much shock joke pictures made room look huge basics room really comfy bed quilted mattress protector always makes difference green policy wont clean room day arrive unless request think quite good idea overall really good experience would definately stay,5,2,fantastic locationstayed hotel nights th june hotel good location loads shops restaurants markets nearby ate restaurants located hotel guest discount food really good room spotless th floor room small knew arrived wasnt much shock joke pictures made room look huge basics room really comfy bed quilted mattress protector always makes difference green policy wont clean room day arrive unless request think quite good idea overall really good experience would definately stay,"{'neg': 0.048, 'neu': 0.722, 'pos': 0.229, 'compound': 0.9386}",0.9386,2
cosy stay,consider price please look promotion packages website location service overall staying hotel g make us feel comfortable relax daryl goh serve us also impress us excellent pride service initial upgrade queen size bedroom single beds without charge explaining much convenience mum walk night true really thoughtful also early check us explaining everything detail make stay enjoyable definitely back,5,2,cosy stayconsider price please look promotion packages website location service overall staying hotel g make us feel comfortable relax daryl goh serve us also impress us excellent pride service initial upgrade queen size bedroom single beds without charge explaining much convenience mum walk night true really thoughtful also early check us explaining everything detail make stay enjoyable definitely back,"{'neg': 0.0, 'neu': 0.625, 'pos': 0.375, 'compound': 0.9794}",0.9794,2
