Review Title,Review Description,Review Rating,Sentiment,Review,scores,compound,SIA_sentiment_type
much room improvement,bathroom small especially shower area cant decent shower without hitting things rain shower pathetic pressure slow place put luggage properly easy access stuff also cabinet hang clothes bed also placed awkward position second person required climb first person order sleep get bed lights entrance sink could switched thus nightmare get decent sleep sick tiny inconvenient brush teeth wash powder face,3,1,much room improvementbathroom small especially shower area cant decent shower without hitting things rain shower pathetic pressure slow place put luggage properly easy access stuff also cabinet hang clothes bed also placed awkward position second person required climb first person order sleep get bed lights entrance sink could switched thus nightmare get decent sleep sick tiny inconvenient brush teeth wash powder face,"{'neg': 0.183, 'neu': 0.777, 'pos': 0.04, 'compound': -0.8519}",-0.8519,0
quite good,location hotel good docoration room beautiful room size small even place open luggage channel tv program choose happy refrigerator inconvenient,4,2,quite goodlocation hotel good docoration room beautiful room size small even place open luggage channel tv program choose happy refrigerator inconvenient,"{'neg': 0.08, 'neu': 0.564, 'pos': 0.357, 'compound': 0.8542}",0.8542,2
great overnight stay,singapore one night touched town pm staff ready receive despite coming close midnight accommodating room nice comfortable night sleep would definitely come back,5,2,great overnight staysingapore one night touched town pm staff ready receive despite coming close midnight accommodating room nice comfortable night sleep would definitely come back,"{'neg': 0.0, 'neu': 0.565, 'pos': 0.435, 'compound': 0.9371}",0.9371,2
good hotel strange shower room design,like hotel location good besides daily room rate also good budget travels however something need address first thing weird shower room design sure room problem rooms similar symptom floor always wet shower uncomfortable especially go toilet night always made feet wet otherwise good hotel,4,2,good hotel strange shower room designlike hotel location good besides daily room rate also good budget travels however something need address first thing weird shower room design sure room problem rooms similar symptom floor always wet shower uncomfortable especially go toilet night always made feet wet otherwise good hotel,"{'neg': 0.14, 'neu': 0.638, 'pos': 0.222, 'compound': 0.7269}",0.7269,2
good,size room large atmosphere good flooring settled wood material water area also cleaned well bed also comfortable disappointing refrigerator room,5,2,goodsize room large atmosphere good flooring settled wood material water area also cleaned well bed also comfortable disappointing refrigerator room,"{'neg': 0.116, 'neu': 0.582, 'pos': 0.302, 'compound': 0.6249}",0.6249,2
decent stay unhelpful service,everything good thing improved pillow soft painful neck however left pair spectacles called check retrieve hotel staff never got back us asked said spectacles found staff helpful ask info even bother also complimentary parking even though carpark within building,3,1,decent stay unhelpful serviceeverything good thing improved pillow soft painful neck however left pair spectacles called check retrieve hotel staff never got back us asked said spectacles found staff helpful ask info even bother also complimentary parking even though carpark within building,"{'neg': 0.1, 'neu': 0.679, 'pos': 0.221, 'compound': 0.7506}",0.7506,2
hotel g sg highly recommend,pleasure stay rooms clean comfortable spacious homely staff helpful extremely friendly got us bind found stuck hotel short notice previous booking elsewhere end one night due various problems hotel g came rescue affordable price gave us somewhere truly enjoyable stay remainder trip nights definitely return find singapore would highly recommend hotel anyone planning trip,5,2,hotel g sg highly recommendpleasure stay rooms clean comfortable spacious homely staff helpful extremely friendly got us bind found stuck hotel short notice previous booking elsewhere end one night due various problems hotel g came rescue affordable price gave us somewhere truly enjoyable stay remainder trip nights definitely return find singapore would highly recommend hotel anyone planning trip,"{'neg': 0.061, 'neu': 0.588, 'pos': 0.351, 'compound': 0.969}",0.969,2
amazing hotel prime location,hotel amazing located prime location mrt stations nearby bugis street dhoby ghaut bencoolen walking distance morning breakfast good room clean cozy bathroom small ignored provide handy phone use city free local calls data really helpful navigating around using maps great stay,5,2,amazing hotel prime locationhotel amazing located prime location mrt stations nearby bugis street dhoby ghaut bencoolen walking distance morning breakfast good room clean cozy bathroom small ignored provide handy phone use city free local calls data really helpful navigating around using maps great stay,"{'neg': 0.037, 'neu': 0.581, 'pos': 0.382, 'compound': 0.9698}",0.9698,2
decent hotel excellent rates,hotel clean convenient decently located good distance mrts hotel nicely designed well one problem would lift maintenance resulting long waiting time get room,4,2,decent hotel excellent rateshotel clean convenient decently located good distance mrts hotel nicely designed well one problem would lift maintenance resulting long waiting time get room,"{'neg': 0.073, 'neu': 0.541, 'pos': 0.386, 'compound': 0.891}",0.891,2
victim theft,family adults booked rooms nights get rooms next others location excellent room really small place store clothes intimity bathroom sliding door made glass close properly also light bathroom gives light room wakes person decoration industrial type dark sad left hand bag room purse around eur stolen,2,0,victim theftfamily adults booked rooms nights get rooms next others location excellent room really small place store clothes intimity bathroom sliding door made glass close properly also light bathroom gives light room wakes person decoration industrial type dark sad left hand bag room purse around eur stolen,"{'neg': 0.147, 'neu': 0.733, 'pos': 0.12, 'compound': -0.128}",-0.128,0
excellent experience,clean convenient location friendly staff definitely chose hotel visit singapore future bed comfortable asia weeks best sleeping quality night hotel g,5,2,excellent experienceclean convenient location friendly staff definitely chose hotel visit singapore future bed comfortable asia weeks best sleeping quality night hotel g,"{'neg': 0.0, 'neu': 0.483, 'pos': 0.517, 'compound': 0.9524}",0.9524,2
nice hotel singapore,hotel well located next mrt stations breakfast copious food good room big necessary equipment quite big plus phone internet provided stay,4,2,nice hotel singaporehotel well located next mrt stations breakfast copious food good room big necessary equipment quite big plus phone internet provided stay,"{'neg': 0.0, 'neu': 0.719, 'pos': 0.281, 'compound': 0.7783}",0.7783,2
best hotel amazing location,arrived hotel g singapore short flight thailand jumped straight onto mrt bencoolen less minute walk away hotel really get walking bar going disabled lift another lift reception welcoming welcome reception something would nice come arrived reception much welcome asked straight away passports hello anything said passports young guy checked us seemed try send us away welcome singapore anything asked map singapore seemed issue maybe get lesson customer service went room th floor even,2,0,best hotel amazing locationarrived hotel g singapore short flight thailand jumped straight onto mrt bencoolen less minute walk away hotel really get walking bar going disabled lift another lift reception welcoming welcome reception something would nice come arrived reception much welcome asked straight away passports hello anything said passports young guy checked us seemed try send us away welcome singapore anything asked map singapore seemed issue maybe get lesson customer service went room th floor even,"{'neg': 0.0, 'neu': 0.714, 'pos': 0.286, 'compound': 0.9764}",0.9764,2
check,overall satisfied check ok arrived pm staff said room ready yet keep offering want take wellcome drink level asked check time said normally pm last experience hotel check even,4,2,checkoverall satisfied check ok arrived pm staff said room ready yet keep offering want take wellcome drink level asked check time said normally pm last experience hotel check even,"{'neg': 0.0, 'neu': 0.74, 'pos': 0.26, 'compound': 0.7783}",0.7783,2
testament good design,stayed greater room singapore still small lobby accessed via ramp car park said us staying room still felt plenty space walk around double bed wall mounted tv everything else fine good shower decent amenities good lighting clever design maximise space lift maintenance one three lifts resulting lot waiting around partly cleaners enormous trolleys fill lift maybe get narrower ones make easier get others everything kinda fine massively elevated fantastic wine bar restaurant ginnet,4,2,testament good designstayed greater room singapore still small lobby accessed via ramp car park said us staying room still felt plenty space walk around double bed wall mounted tv everything else fine good shower decent amenities good lighting clever design maximise space lift maintenance one three lifts resulting lot waiting around partly cleaners enormous trolleys fill lift maybe get narrower ones make easier get others everything kinda fine massively elevated fantastic wine bar restaurant ginnet,"{'neg': 0.0, 'neu': 0.72, 'pos': 0.28, 'compound': 0.9694}",0.9694,2
good hotel conveniently located,arrived friday night pm learned room ready told wait shortly minutes unfortunately without explanation great receive voucher bar unfortunately hurry appointment later evening inconvenience caused slight delay want go without shower hours flight nevertheless rest stay veeb positive experience clean hotel breakfast selection huge sufficient good quality staff friendly always happy help location conveniently located easy reach taxis public transportation,4,2,good hotel conveniently locatedarrived friday night pm learned room ready told wait shortly minutes unfortunately without explanation great receive voucher bar unfortunately hurry appointment later evening inconvenience caused slight delay want go without shower hours flight nevertheless rest stay veeb positive experience clean hotel breakfast selection huge sufficient good quality staff friendly always happy help location conveniently located easy reach taxis public transportation,"{'neg': 0.142, 'neu': 0.507, 'pos': 0.351, 'compound': 0.951}",0.951,2
day vacay hotel g,totally enjoyed staying hotel g staff friendly professional courteous solo traveler small room perfect small bag could place underneath bed bed comfortable however toilet inside shower different experience great location bugis within walking distance becoolen mrt walking distance bugis village waterloo street see different sites great bar downstairs allow pay room deposit sgd cash use credit card return cash back right away credit card takes days depending bank bottle water room tasty room snacks purchase check nd floor lift,5,2,day vacay hotel gtotally enjoyed staying hotel g staff friendly professional courteous solo traveler small room perfect small bag could place underneath bed bed comfortable however toilet inside shower different experience great location bugis within walking distance becoolen mrt walking distance bugis village waterloo street see different sites great bar downstairs allow pay room deposit sgd cash use credit card return cash back right away credit card takes days depending bank bottle water room tasty room snacks purchase check nd floor lift,"{'neg': 0.014, 'neu': 0.676, 'pos': 0.31, 'compound': 0.9844}",0.9844,2
good,staffs friendly especially room service staffs polite nice room clean nice except lift take longer time lighting room night light combination good toilet light bright nite haha overall good,4,2,goodstaffs friendly especially room service staffs polite nice room clean nice except lift take longer time lighting room night light combination good toilet light bright nite haha overall good,"{'neg': 0.0, 'neu': 0.475, 'pos': 0.525, 'compound': 0.969}",0.969,2
nice small,great little hotel good location clean modern room however small couple ideal room solo traveler simply enough room throughout room one person breakfast quite good adequate selection variety also downstairs bar cafe feel like afternoon evening drink would definitely recommend hotel traveling alone,4,2,nice smallgreat little hotel good location clean modern room however small couple ideal room solo traveler simply enough room throughout room one person breakfast quite good adequate selection variety also downstairs bar cafe feel like afternoon evening drink would definitely recommend hotel traveling alone,"{'neg': 0.033, 'neu': 0.566, 'pos': 0.4, 'compound': 0.9639}",0.9639,2
excellent trip,hotel worth value service top notch comparable star hotel staff friendly helpful clean room internet provided extra cost location convenient bugis junction bugis street local food available steps away definitely use hotel next time come singapore,5,2,excellent triphotel worth value service top notch comparable star hotel staff friendly helpful clean room internet provided extra cost location convenient bugis junction bugis street local food available steps away definitely use hotel next time come singapore,"{'neg': 0.0, 'neu': 0.578, 'pos': 0.422, 'compound': 0.9595}",0.9595,2
best quality hotel singapore,hotel clean correspondence hotel staff also polite felt service good snacks left hotel stay satisfied hotel hotel recommended friends,5,2,best quality hotel singaporehotel clean correspondence hotel staff also polite felt service good snacks left hotel stay satisfied hotel hotel recommended friends,"{'neg': 0.0, 'neu': 0.478, 'pos': 0.522, 'compound': 0.9477}",0.9477,2
good experience,well located close little india hanji lane trendy bali lane bar nices shops restaurants mrt min easy get chinatown marina bay staff us helpful upgrade larger room appriciable guillaume customers manager pro active handle problem question thank lot take care us really appriciate ginette restaurant food great large wine selection recommand hotel,5,2,good experiencewell located close little india hanji lane trendy bali lane bar nices shops restaurants mrt min easy get chinatown marina bay staff us helpful upgrade larger room appriciable guillaume customers manager pro active handle problem question thank lot take care us really appriciate ginette restaurant food great large wine selection recommand hotel,"{'neg': 0.039, 'neu': 0.654, 'pos': 0.307, 'compound': 0.9545}",0.9545,2
excellent location nice deco friendly,excellent location far train station bugis staff friendly rooms welle equipped opinion small pieces luggage hard walk room thinkbi could regret,5,2,excellent location nice deco friendlyexcellent location far train station bugis staff friendly rooms welle equipped opinion small pieces luggage hard walk room thinkbi could regret,"{'neg': 0.124, 'neu': 0.59, 'pos': 0.286, 'compound': 0.7579}",0.7579,2
small cramp,room good view comfortable bed thats compliment staycation hotel g yesterday upset room size really small cramp totally walking space everything chargeable room eg snacks laundry bag room slipper bag etc bathroom uses curtains separate space switches messily allocated hotel reception located nd floor small area inaccessible lifts working lifts serving floors parking complimentary parking hotel guest first time experience per hour rate park hours purchase call time packing voucher tourist hotel g location,1,0,small cramproom good view comfortable bed thats compliment staycation hotel g yesterday upset room size really small cramp totally walking space everything chargeable room eg snacks laundry bag room slipper bag etc bathroom uses curtains separate space switches messily allocated hotel reception located nd floor small area inaccessible lifts working lifts serving floors parking complimentary parking hotel guest first time experience per hour rate park hours purchase call time packing voucher tourist hotel g location,"{'neg': 0.056, 'neu': 0.799, 'pos': 0.145, 'compound': 0.8187}",0.8187,2
recommended,shower hose leaking water flush failed hotel came fixed afterwards works half time shower room leaking water outside use room refrigerator hotel policy shared fridge lobby sigh linen clearly dirty house cleaning replace hotel policy new linens every days,1,0,recommendedshower hose leaking water flush failed hotel came fixed afterwards works half time shower room leaking water outside use room refrigerator hotel policy shared fridge lobby sigh linen clearly dirty house cleaning replace hotel policy new linens every days,"{'neg': 0.133, 'neu': 0.71, 'pos': 0.157, 'compound': -0.2263}",-0.2263,0
new favourite boutique hotel,hotel g standout amongst budget mid range hotels central singapore frequent visitor startup ceo progressively trying promise attributes hotel g make hard beat attitude atmosphere high end boutique hotel prices relatively low gym high standard better expected bars restaurants level upmarket create incredible ambiance enjoy come home also make convenient meeting place proud lobby funky staff professional room designs intelligent clean space saving bed comfortable walls thick heard noise complaints properties,5,2,new favourite boutique hotelhotel g standout amongst budget mid range hotels central singapore frequent visitor startup ceo progressively trying promise attributes hotel g make hard beat attitude atmosphere high end boutique hotel prices relatively low gym high standard better expected bars restaurants level upmarket create incredible ambiance enjoy come home also make convenient meeting place proud lobby funky staff professional room designs intelligent clean space saving bed comfortable walls thick heard noise complaints properties,"{'neg': 0.084, 'neu': 0.653, 'pos': 0.262, 'compound': 0.9442}",0.9442,2
good choice,good location transportation convenient experience good bed comfortable room fashionably decorated little small first floor bar welcome drinks,5,2,good choicegood location transportation convenient experience good bed comfortable room fashionably decorated little small first floor bar welcome drinks,"{'neg': 0.0, 'neu': 0.554, 'pos': 0.446, 'compound': 0.9022}",0.9022,2
value money,great stay night partner cleanliness room great well although room smaller bit facilities still location great easy find food around u plan visit singapore pay try,5,2,value moneygreat stay night partner cleanliness room great well although room smaller bit facilities still location great easy find food around u plan visit singapore pay try,"{'neg': 0.038, 'neu': 0.541, 'pos': 0.422, 'compound': 0.9349}",0.9349,2
exellent location,location best near hawker shopping center bugis area room small shower place small internet sometimes good need improve lift service slow breakfast ok,4,2,exellent locationlocation best near hawker shopping center bugis area room small shower place small internet sometimes good need improve lift service slow breakfast ok,"{'neg': 0.0, 'neu': 0.621, 'pos': 0.379, 'compound': 0.9042}",0.9042,2
overall good,staffs always polite friendly ready help hotel interior nice room clean location great far away bencoolen mrt station convenient lots breakfast variation,5,2,overall goodstaffs always polite friendly ready help hotel interior nice room clean location great far away bencoolen mrt station convenient lots breakfast variation,"{'neg': 0.0, 'neu': 0.486, 'pos': 0.514, 'compound': 0.9517}",0.9517,2
stay,room really compact serve purpose well design room make looks small unfortunately complimentary parking trade cheaper parking ticket afterall pleasant stay would revisit future,4,2,stayroom really compact serve purpose well design room make looks small unfortunately complimentary parking trade cheaper parking ticket afterall pleasant stay would revisit future,"{'neg': 0.078, 'neu': 0.651, 'pos': 0.27, 'compound': 0.7096}",0.7096,2
great service value money,hassle comfortable hotel nights stay room may tad small planning long stay cleanliness good bathrooms also comfortable room size food restaurant good would definitely recommend,5,2,great service value moneyhassle comfortable hotel nights stay room may tad small planning long stay cleanliness good bathrooms also comfortable room size food restaurant good would definitely recommend,"{'neg': 0.0, 'neu': 0.454, 'pos': 0.546, 'compound': 0.9723}",0.9723,2
good experience,hotel location quite good close tube station many restaurants around hotel room large tidy comfortable facilities staff reception restaurant nice helpful,5,2,good experiencehotel location quite good close tube station many restaurants around hotel room large tidy comfortable facilities staff reception restaurant nice helpful,"{'neg': 0.0, 'neu': 0.536, 'pos': 0.464, 'compound': 0.9287}",0.9287,2
good hotel,st time trying hotel quite confused reception st floor staff helpful check lot people short staff taxi number change telling busy wait min taxi ask tell taxi number change please add staff,4,2,good hotelst time trying hotel quite confused reception st floor staff helpful check lot people short staff taxi number change telling busy wait min taxi ask tell taxi number change please add staff,"{'neg': 0.065, 'neu': 0.672, 'pos': 0.264, 'compound': 0.719}",0.719,2
great location funk,bit hectic check large group small reception nice friendly staff restaurant v crowded popular especially oyster night nice cold beers car tricky drive around back small laneway recetion first level,4,2,great location funkbit hectic check large group small reception nice friendly staff restaurant v crowded popular especially oyster night nice cold beers car tricky drive around back small laneway recetion first level,"{'neg': 0.038, 'neu': 0.591, 'pos': 0.371, 'compound': 0.9337}",0.9337,2
awfully long check,reception staff unattentive tour guide service first time visitors reception work quick service frills lean hotel excellent cafe funky room design lean smart hotel,3,1,awfully long checkreception staff unattentive tour guide service first time visitors reception work quick service frills lean hotel excellent cafe funky room design lean smart hotel,"{'neg': 0.045, 'neu': 0.747, 'pos': 0.208, 'compound': 0.7184}",0.7184,2
great stay singapore,great stay singapore love design restaurant vibe hotel g second time stayed one properties first visit yangon one year ago people complain size rooms singapore price range still find hotel offers something bigger rooms smart designed even though lot space fine two people two large suitcases could easily stored bed really enjoyed restaurant good dishes affordable dishes highly recommend,5,2,great stay singaporegreat stay singapore love design restaurant vibe hotel g second time stayed one properties first visit yangon one year ago people complain size rooms singapore price range still find hotel offers something bigger rooms smart designed even though lot space fine two people two large suitcases could easily stored bed really enjoyed restaurant good dishes affordable dishes highly recommend,"{'neg': 0.032, 'neu': 0.652, 'pos': 0.316, 'compound': 0.9692}",0.9692,2
cool,small room cozy comfortable stay would like come back stay cation singapore got time must try relax hotel aircon cold bathroom quite clean overall good,5,2,coolsmall room cozy comfortable stay would like come back stay cation singapore got time must try relax hotel aircon cold bathroom quite clean overall good,"{'neg': 0.0, 'neu': 0.574, 'pos': 0.426, 'compound': 0.9307}",0.9307,2
good value money,go hotel singapore near couple mrt stations makes breeze move around however must say breakfast quality dropped time around less choice hot food deal breaker hotel skimp,5,2,good value moneygo hotel singapore near couple mrt stations makes breeze move around however must say breakfast quality dropped time around less choice hot food deal breaker hotel skimp,"{'neg': 0.0, 'neu': 0.836, 'pos': 0.164, 'compound': 0.6486}",0.6486,2
pretty good room gym,hotel pleasant reception area comfortable staffs nice helpful happy help breakfast good foods tasty especially love pastries sweet section like cookies pancakes waffles perfect suggest could offer savory items egg little bit extra offering fried scrambled hard boiled eggs altogether something like sausage hash brown would even better room extremely small though clearly understood standard type room inside bed also chair work desk use work desk would stand reach end desk near wall got nice design,4,2,pretty good room gymhotel pleasant reception area comfortable staffs nice helpful happy help breakfast good foods tasty especially love pastries sweet section like cookies pancakes waffles perfect suggest could offer savory items egg little bit extra offering fried scrambled hard boiled eggs altogether something like sausage hash brown would even better room extremely small though clearly understood standard type room inside bed also chair work desk use work desk would stand reach end desk near wall got nice design,"{'neg': 0.012, 'neu': 0.521, 'pos': 0.467, 'compound': 0.9941}",0.9941,2
bathroom drainage problem,recommended improve bathroom drainage problems breakfast chosen convenient full elevator needs card security bad location convenient close museum number words,4,2,bathroom drainage problemrecommended improve bathroom drainage problems breakfast chosen convenient full elevator needs card security bad location convenient close museum number words,"{'neg': 0.208, 'neu': 0.57, 'pos': 0.221, 'compound': -0.1531}",-0.1531,0
