Review Title,Review Description,Review Rating,Sentiment,Review,scores,compound,SIA_sentiment_type
good dark receptions small rooms long waiting reception sufficient employees overall good,gloomy dark small reception long waiting reception sufficient staffs help carry luggage poor ambience small room much dissatisfied experience worth money sure since paid already expedia forced complete stay else would ran away,1,0,good dark receptions small rooms long waiting reception sufficient employees overall goodgloomy dark small reception long waiting reception sufficient staffs help carry luggage poor ambience small room much dissatisfied experience worth money sure since paid already expedia forced complete stay else would ran away,"{'neg': 0.157, 'neu': 0.667, 'pos': 0.177, 'compound': 0.0258}",0.0258,2
small room,really good breakfast also good location walk places really fairly priced compared hotels two people plus luggage one room squeeze nice food options around,3,1,small roomreally good breakfast also good location walk places really fairly priced compared hotels two people plus luggage one room squeeze nice food options around,"{'neg': 0.0, 'neu': 0.719, 'pos': 0.281, 'compound': 0.8225}",0.8225,2
trendy hotel nice bar restaurants tiny rooms lobby,hotel designed trendy sort works bar restaurant st floor great decent food big wine list good night scene taste traveling good bit luggage room small cramped hotel busy elevators slow usually crowded lobby tiny jammed people waiting reach front desk get taxi particularly convenient mtr compared many hotels singapore,3,1,trendy hotel nice bar restaurants tiny rooms lobbyhotel designed trendy sort works bar restaurant st floor great decent food big wine list good night scene taste traveling good bit luggage room small cramped hotel busy elevators slow usually crowded lobby tiny jammed people waiting reach front desk get taxi particularly convenient mtr compared many hotels singapore,"{'neg': 0.0, 'neu': 0.77, 'pos': 0.23, 'compound': 0.9169}",0.9169,2
good hotel business visits,stay come singapore business rooms good size one person nice staff good service great facilities around strong wifi room restaurants downstairs,5,2,good hotel business visitsstay come singapore business rooms good size one person nice staff good service great facilities around strong wifi room restaurants downstairs,"{'neg': 0.0, 'neu': 0.488, 'pos': 0.512, 'compound': 0.9578}",0.9578,2
forced overnight stay singapore,forced stay overnight singapore due qantas cancelling flight singapore melbourne rescheduled following night arranged room hotel g offered free late checkout pm needed pm paid additional amount enable relaxing heading airport rooms small functional cafe wine bar downstairs good,4,2,forced overnight stay singaporeforced stay overnight singapore due qantas cancelling flight singapore melbourne rescheduled following night arranged room hotel g offered free late checkout pm needed pm paid additional amount enable relaxing heading airport rooms small functional cafe wine bar downstairs good,"{'neg': 0.096, 'neu': 0.717, 'pos': 0.187, 'compound': 0.6808}",0.6808,2
fabulous hotel,hotel room cozy love concept much modern stylish know exactly someone would want stay hotel hey make effort ensure looks nice attended shawn ana friendly helpful staff earlier pleasant experience radha troubled fact flight rescheduled evening quick help extension super friendly despite crowd getting busier hotel great even degree restaurant fantastic went branch la fell love milkshake get relive memory,5,2,fabulous hotelhotel room cozy love concept much modern stylish know exactly someone would want stay hotel hey make effort ensure looks nice attended shawn ana friendly helpful staff earlier pleasant experience radha troubled fact flight rescheduled evening quick help extension super friendly despite crowd getting busier hotel great even degree restaurant fantastic went branch la fell love milkshake get relive memory,"{'neg': 0.032, 'neu': 0.488, 'pos': 0.48, 'compound': 0.9914}",0.9914,2
good value good location,would say good hotel short stay rooms small functional clean alone room ok people baggage would little crowded longer stay breakfast fair layout food confusing found annoying lobby small get crowded first impression hotel due lobby area good staff would rate average location convenient short walk nearby attractions shops would visit business alone traveling partner would probably go elsewhere slightly larger room,4,2,good value good locationwould say good hotel short stay rooms small functional clean alone room ok people baggage would little crowded longer stay breakfast fair layout food confusing found annoying lobby small get crowded first impression hotel due lobby area good staff would rate average location convenient short walk nearby attractions shops would visit business alone traveling partner would probably go elsewhere slightly larger room,"{'neg': 0.1, 'neu': 0.572, 'pos': 0.328, 'compound': 0.9477}",0.9477,2
small clean good location,stayed early november room th floor small practical hotel situated less quarter mile nearest mrt hotel burger joint bustling night burger joint also serves breakfast buffet breakfast decent combination western local offerings one minor gripe room sink sits outside bath toilet located entry way felt bit odd ventilation bathroom impressive visible audible fan,5,2,small clean good locationstayed early november room th floor small practical hotel situated less quarter mile nearest mrt hotel burger joint bustling night burger joint also serves breakfast buffet breakfast decent combination western local offerings one minor gripe room sink sits outside bath toilet located entry way felt bit odd ventilation bathroom impressive visible audible fan,"{'neg': 0.036, 'neu': 0.791, 'pos': 0.174, 'compound': 0.836}",0.836,2
decent hotel good location,booked stay hotel g nights singapore brief stopover chose hotel primarily location city centre min walk away raffles city mall also within mins walk bencoolen mrt quite ideally placed travelling around city easily like lot trendy hipster ish hotels converted office building small lobby entered lobby check found rather unpleasantly crowded people queuing desks empty seats left people waiting checking simple enough allow us check pm unless upgraded room additional sgd nights quibble room fine,3,1,decent hotel good locationbooked stay hotel g nights singapore brief stopover chose hotel primarily location city centre min walk away raffles city mall also within mins walk bencoolen mrt quite ideally placed travelling around city easily like lot trendy hipster ish hotels converted office building small lobby entered lobby check found rather unpleasantly crowded people queuing desks empty seats left people waiting checking simple enough allow us check pm unless upgraded room additional sgd nights quibble room fine,"{'neg': 0.021, 'neu': 0.785, 'pos': 0.194, 'compound': 0.8999}",0.8999,2
first choice hotel sg,nice staffs strategist location clean room pretty sure going back stay hotel next business personal trip hopefully next time get room view though,5,2,first choice hotel sgnice staffs strategist location clean room pretty sure going back stay hotel next business personal trip hopefully next time get room view though,"{'neg': 0.0, 'neu': 0.669, 'pos': 0.331, 'compound': 0.872}",0.872,2
money better spent elsewhere,subpar customer service tiny rooms average bed biggest peeve slow snail lifts planning stay expect waste anywhere minutes waiting elevators,3,1,money better spent elsewheresubpar customer service tiny rooms average bed biggest peeve slow snail lifts planning stay expect waste anywhere minutes waiting elevators,"{'neg': 0.105, 'neu': 0.787, 'pos': 0.109, 'compound': 0.0258}",0.0258,2
cute little stay concerns,mind small hotels hotel lobby small actually causes problems like long line space really stand put baggage since lobby small lineup check actually ended right front elevator checkout thought quite safe way blocked convenient problem tiny room imagined viewing photos booking sites couple small baggage okay queen double bed quite comfortable note remind easy one sleeps inner side bed basically walk bed thru another person breakfast pleasant way food,3,1,cute little stay concernsmind small hotels hotel lobby small actually causes problems like long line space really stand put baggage since lobby small lineup check actually ended right front elevator checkout thought quite safe way blocked convenient problem tiny room imagined viewing photos booking sites couple small baggage okay queen double bed quite comfortable note remind easy one sleeps inner side bed basically walk bed thru another person breakfast pleasant way food,"{'neg': 0.086, 'neu': 0.664, 'pos': 0.25, 'compound': 0.9157}",0.9157,2
great location room service cheerful staffs ginett,room esp btahroom small good person bed linens towels sometimes dirty check water paper box awful terrible tastes disgusting like soaked water tv channels disappointment foxlife axn nickelodeon staffs coffeeshop ginnett cheerful nice hostile attitude esp indians frowning faces terrible chaotic breakfast crowded u senior pwd inconvenient coz stairs u go get food airconditioning hot inside great location though near bus stops mrt bugis mall supermarkets restaurants,3,1,great location room service cheerful staffs ginettroom esp btahroom small good person bed linens towels sometimes dirty check water paper box awful terrible tastes disgusting like soaked water tv channels disappointment foxlife axn nickelodeon staffs coffeeshop ginnett cheerful nice hostile attitude esp indians frowning faces terrible chaotic breakfast crowded u senior pwd inconvenient coz stairs u go get food airconditioning hot inside great location though near bus stops mrt bugis mall supermarkets restaurants,"{'neg': 0.289, 'neu': 0.493, 'pos': 0.218, 'compound': -0.6808}",-0.6808,0
overall okay,room okay compact need gotta aware space usage stated complimentary bought water outside notes fliers wall quite confusing also one thing satisfied toilet floor tap stinky lobby access confusing,4,2,overall okayroom okay compact need gotta aware space usage stated complimentary bought water outside notes fliers wall quite confusing also one thing satisfied toilet floor tap stinky lobby access confusing,"{'neg': 0.178, 'neu': 0.596, 'pos': 0.225, 'compound': 0.2057}",0.2057,2
relaxing,check arrived one day late due delayed flight staff find name said tell booking day earlier sure matter mentioned first thing arrived counter due cramped lobby uncomfortable stand wait check checkout even worse line stretched elevators say staff always pleasant helpful good check check experience room tiny fine two much baggage kinda open one bag time place bed great sleep great room quiet floor water machine outside door great breakfast bad experience us great,3,1,relaxingcheck arrived one day late due delayed flight staff find name said tell booking day earlier sure matter mentioned first thing arrived counter due cramped lobby uncomfortable stand wait check checkout even worse line stretched elevators say staff always pleasant helpful good check check experience room tiny fine two much baggage kinda open one bag time place bed great sleep great room quiet floor water machine outside door great breakfast bad experience us great,"{'neg': 0.109, 'neu': 0.58, 'pos': 0.311, 'compound': 0.9618}",0.9618,2
hot water temp stable,hot water temp stable suddenly hot cold never get right temp showering time others fine comment limited min letters also bad exp kind force almost guest provide comments kind negative requirements otherwise would get positive comment interested parties know mean haaaa,3,1,hot water temp stablehot water temp stable suddenly hot cold never get right temp showering time others fine comment limited min letters also bad exp kind force almost guest provide comments kind negative requirements otherwise would get positive comment interested parties know mean haaaa,"{'neg': 0.145, 'neu': 0.541, 'pos': 0.315, 'compound': 0.8658}",0.8658,2
awesome,friendly staff kind rooms decor awesome everything person needs cleaning lady nice great job would like go hotel definitely first choice close mrt station busses also,5,2,awesomefriendly staff kind rooms decor awesome everything person needs cleaning lady nice great job would like go hotel definitely first choice close mrt station busses also,"{'neg': 0.0, 'neu': 0.505, 'pos': 0.495, 'compound': 0.9618}",0.9618,2
great room amazing restaurant,staying hotel every time visited love room restaurant subway great walk bugis lot cute cafes around mins walk national museum,5,2,great room amazing restaurantstaying hotel every time visited love room restaurant subway great walk bugis lot cute cafes around mins walk national museum,"{'neg': 0.0, 'neu': 0.484, 'pos': 0.516, 'compound': 0.9648}",0.9648,2
small rooms,meter wide bed walls extra space like living corridor first room got even smaller asked change option clean designed service good staff maximum,3,1,small roomsmeter wide bed walls extra space like living corridor first room got even smaller asked change option clean designed service good staff maximum,"{'neg': 0.0, 'neu': 0.722, 'pos': 0.278, 'compound': 0.7964}",0.7964,2
st choice,second stay hotel g one recommend place sister family however experience last stay understand job keep friendly environment saving water etc sister pulled whole bed sheet rd day baby regurgitate milk cleaner would understand must changed yet bed sheet change neither blanket make room vacuum hair floor even told front counter hairdryer bag dusty besides mentioned issue staff including cleaners friendly nice,3,1,st choicesecond stay hotel g one recommend place sister family however experience last stay understand job keep friendly environment saving water etc sister pulled whole bed sheet rd day baby regurgitate milk cleaner would understand must changed yet bed sheet change neither blanket make room vacuum hair floor even told front counter hairdryer bag dusty besides mentioned issue staff including cleaners friendly nice,"{'neg': 0.0, 'neu': 0.81, 'pos': 0.19, 'compound': 0.9081}",0.9081,2
clean stay,second time stay experience good last time due found hair ground even new towel finish shower suggest pay attention better stay experience customer thanks,3,1,clean staysecond time stay experience good last time due found hair ground even new towel finish shower suggest pay attention better stay experience customer thanks,"{'neg': 0.043, 'neu': 0.61, 'pos': 0.348, 'compound': 0.875}",0.875,2
basic sufficient accommodation,consistently shared room size small sufficient solo stay luggage kept bed stay partner hotel simply small room setup maximizing every angle functional tv side wall need turn head want watch tv rain shower powerful hot good cleanliness expectation ceiling bulb cable full dust bathroom grouting sliding door track dirty disgusting breakfast sufficient start day full tummy croissant pastries good brewed coffee little thin provide bottled drinking water common water dispenser corridor please bring bottle,4,2,basic sufficient accommodationconsistently shared room size small sufficient solo stay luggage kept bed stay partner hotel simply small room setup maximizing every angle functional tv side wall need turn head want watch tv rain shower powerful hot good cleanliness expectation ceiling bulb cable full dust bathroom grouting sliding door track dirty disgusting breakfast sufficient start day full tummy croissant pastries good brewed coffee little thin provide bottled drinking water common water dispenser corridor please bring bottle,"{'neg': 0.071, 'neu': 0.765, 'pos': 0.164, 'compound': 0.743}",0.743,2
nice hotel stay,nice hotel convenient since near mrt station got many good food around got bar nice restaurant first floor nice experience also receptionist farhan helpful,5,2,nice hotel staynice hotel convenient since near mrt station got many good food around got bar nice restaurant first floor nice experience also receptionist farhan helpful,"{'neg': 0.0, 'neu': 0.598, 'pos': 0.402, 'compound': 0.9201}",0.9201,2
expected,room way smaller thought rather pay extra staying destination holiday inn express also table work small ants running around know say didnt report stay nights,3,1,expectedroom way smaller thought rather pay extra staying destination holiday inn express also table work small ants running around know say didnt report stay nights,"{'neg': 0.052, 'neu': 0.849, 'pos': 0.1, 'compound': 0.3182}",0.3182,2
great location frills value,overall satisfied stay hotel g room really small mostly everything needed location great thoughts feedback liked wifi good complicated setup water machine blessing use water bottle reduce waste super useful hair drier strong solid liked tv channels offered especially bbc earth fox movies hbo gym simple equipment new good could little cooler imo like shower curtain made shower area really small curtains unhygienic general single use plastic toiletries opportunity reduce waste air conditioner weird would wake middle night sometimes would,3,1,great location frills valueoverall satisfied stay hotel g room really small mostly everything needed location great thoughts feedback liked wifi good complicated setup water machine blessing use water bottle reduce waste super useful hair drier strong solid liked tv channels offered especially bbc earth fox movies hbo gym simple equipment new good could little cooler imo like shower curtain made shower area really small curtains unhygienic general single use plastic toiletries opportunity reduce waste air conditioner weird would wake middle night sometimes would,"{'neg': 0.064, 'neu': 0.567, 'pos': 0.369, 'compound': 0.9873}",0.9873,2
small rooms,location hotel good indeed within walking distance three mrt stations bugis dhoby ghaut closest bencoolen took single room small indeed serious check time got told come pm opened door room also check time noon key deactivated time breakfast good english breakfast continental breakfast coffee juice water etc included restaurant two levels walked esplanade bugis far plenty budget dinner places near vicinity burger place degrees open around happy hour food ending pm,3,1,small roomslocation hotel good indeed within walking distance three mrt stations bugis dhoby ghaut closest bencoolen took single room small indeed serious check time got told come pm opened door room also check time noon key deactivated time breakfast good english breakfast continental breakfast coffee juice water etc included restaurant two levels walked esplanade bugis far plenty budget dinner places near vicinity burger place degrees open around happy hour food ending pm,"{'neg': 0.016, 'neu': 0.863, 'pos': 0.121, 'compound': 0.8481}",0.8481,2
g good hotel good,great location nearby mrt stations bras basah bencooleen hrs indian restaurant outside hotel also across street need buy snaks middle night house burgers taste good room fridge ok get cold water water dispenser located corner floor oyeah hotel provide free handy phone anymore fine nevertheless wi fi router available rent sure much change overall like stay hotel room clean bed comfortable overal th,4,2,g good hotel goodgreat location nearby mrt stations bras basah bencooleen hrs indian restaurant outside hotel also across street need buy snaks middle night house burgers taste good room fridge ok get cold water water dispenser located corner floor oyeah hotel provide free handy phone anymore fine nevertheless wi fi router available rent sure much change overall like stay hotel room clean bed comfortable overal th,"{'neg': 0.0, 'neu': 0.701, 'pos': 0.299, 'compound': 0.9678}",0.9678,2
nice location nice service best bed,hotel near mrt bus stops many hotspots comfy bed like modern hip design room staffs nice also water refilling stations per floor nice touch save money,5,2,nice location nice service best bedhotel near mrt bus stops many hotspots comfy bed like modern hip design room staffs nice also water refilling stations per floor nice touch save money,"{'neg': 0.035, 'neu': 0.503, 'pos': 0.462, 'compound': 0.9612}",0.9612,2
convenient location,good location mrt midnight snack hearty breakfast luggage storage service good room clean big bed tow person room space smaller many big luggages may discuss counter staff water fountain walkway room service quick questions room facilities,5,2,convenient locationgood location mrt midnight snack hearty breakfast luggage storage service good room clean big bed tow person room space smaller many big luggages may discuss counter staff water fountain walkway room service quick questions room facilities,"{'neg': 0.0, 'neu': 0.862, 'pos': 0.138, 'compound': 0.6808}",0.6808,2
first time stay,hotel g conveniently located within areas interest bugis orchard road suntec etc like stay around bencoolen everything within walking distance decided give hotel g try must say like hotel hotel staff polite efficient helpful well room size actually small mind husband asian built certainly come back hotel,4,2,first time stayhotel g conveniently located within areas interest bugis orchard road suntec etc like stay around bencoolen everything within walking distance decided give hotel g try must say like hotel hotel staff polite efficient helpful well room size actually small mind husband asian built certainly come back hotel,"{'neg': 0.0, 'neu': 0.688, 'pos': 0.312, 'compound': 0.9442}",0.9442,2
location service facilities,location busy crowded area near bus stations minute walk mrt service nice staff warm facilities fairly new room small layout efficient congratulations hotel g team keep quality,5,2,location service facilitieslocation busy crowded area near bus stations minute walk mrt service nice staff warm facilities fairly new room small layout efficient congratulations hotel g team keep quality,"{'neg': 0.0, 'neu': 0.678, 'pos': 0.322, 'compound': 0.886}",0.886,2
great hotel,great hotel chic modern vibe throughout stayed hotel g last july first trip singapore hesitate book visit year rooms good size singapore enough room luggage however people may struggle staff super friendly helpful assisting guests every need breakfast good standard however get busy due volume guests impressed hesitate stay,4,2,great hotelgreat hotel chic modern vibe throughout stayed hotel g last july first trip singapore hesitate book visit year rooms good size singapore enough room luggage however people may struggle staff super friendly helpful assisting guests every need breakfast good standard however get busy due volume guests impressed hesitate stay,"{'neg': 0.094, 'neu': 0.547, 'pos': 0.36, 'compound': 0.9612}",0.9612,2
great solo travellers,recently stayed hotel g would recommend looking affordable clean accomodation convenient location arrived early hours morning check nice quick thought styling quite cute like dream catcher bed thought layout made good use space yes bed takes length end pictures clearly show understand anyone would gripe appreciate inconvenient roll top partner need use loo middle night consider booking place said renovating rooms floor peeked saw turned angle bed people,4,2,great solo travellersrecently stayed hotel g would recommend looking affordable clean accomodation convenient location arrived early hours morning check nice quick thought styling quite cute like dream catcher bed thought layout made good use space yes bed takes length end pictures clearly show understand anyone would gripe appreciate inconvenient roll top partner need use loo middle night consider booking place said renovating rooms floor peeked saw turned angle bed people,"{'neg': 0.026, 'neu': 0.611, 'pos': 0.363, 'compound': 0.9815}",0.9815,2
singapore grand prix,recommend hotel perfect location mins walk track breakfast excellent restaurant bar also good staff looked us brilliantly oyster night fabulous,5,2,singapore grand prixrecommend hotel perfect location mins walk track breakfast excellent restaurant bar also good staff looked us brilliantly oyster night fabulous,"{'neg': 0.0, 'neu': 0.436, 'pos': 0.564, 'compound': 0.967}",0.967,2
good stay business family trip,nice clean hotel room bit small well functions staff welcome polite water fridge provide room service water provide common area outside room,4,2,good stay business family tripnice clean hotel room bit small well functions staff welcome polite water fridge provide room service water provide common area outside room,"{'neg': 0.0, 'neu': 0.673, 'pos': 0.327, 'compound': 0.8658}",0.8658,2
good service,staff helpful friendly location fine wi fi worked well probably hotel like star hotel great time singapore probably return see rest city,4,2,good servicestaff helpful friendly location fine wi fi worked well probably hotel like star hotel great time singapore probably return see rest city,"{'neg': 0.0, 'neu': 0.452, 'pos': 0.548, 'compound': 0.9545}",0.9545,2
careful,opened door room jaws dropped even big enough fit two suitcases closer inspection double bed fixed wall bathroom shower toilet asked another room charged additional sgd per nite upgrade well room better bed still fixed wall asked beds told beds fixed wall practical couples especially years old would never recommend hotel couples,2,0,carefulopened door room jaws dropped even big enough fit two suitcases closer inspection double bed fixed wall bathroom shower toilet asked another room charged additional sgd per nite upgrade well room better bed still fixed wall asked beds told beds fixed wall practical couples especially years old would never recommend hotel couples,"{'neg': 0.067, 'neu': 0.805, 'pos': 0.128, 'compound': 0.5559}",0.5559,2
