Staycation,"We all have different expectations based on the price we paid for the hotel stay. For a 5 star hotel, i will have a set of higher expectations and more critical but i am fully aware that this is not a 5 star hotel, and for the price i paid for yotel, it is definitely value for money, if not exceeding expectations.  Some criterion cannot be compromised no matter the class of hotel. They are..   Cleanliness The hotel is clean, the towels are fresh, and no foul or cigarette smell.  Functionality The heater and aircon is working fine. The lights are working fine, in fact didn't find any faulty areas  Basic Ammenities There are shampoos, body wash, hand wash, body mosturiser, toothpaste and toothbrush. Hair dryer, iron and even an umbrella. (considering the rainy weather in sg)  …",50,May-21,Travelled as a couple,47,33
"So-so, you get what you paid for","The hotel was difficult to find, needed 5-10 mins of walk. Rooms were tiny, but overall it was clean and the service was not bad. The views were meh, breakfast was slightly cold when it was served to me.",40,Apr-21,Undisclosed,3,5
"Cabin concept, simple yet stylish","The room may be smaller than other hotels but there are space under the bed for big luggage, a luggage rack and a open concept closet to open the small luggage. The food at komyuniti is delicious! Try the carbonara and juices! They also have many promotions. Rooms had the basic amenities and the pool is small but pretty. Gym has limited facilities but enough for basic workout like weights,treadmills etc. Bed is comfortable and pillows have two types I believe. It is still soft pillows but frankly, harder than many other branded hotels I stayed in. The service is awesome. They wrote a handwritten card and that's not something all hotels invest time in. Theres no bellman but expected from the covid situation of manpower crunch. Overall a good stay, will recommend if your priority…",50,Apr-21,Undisclosed,4,3
Relaxation staycation,"Stayed in yotel orchard! Would love to thanks to “Winnie” front office staff who is friendly greeted us when the first moment we are going to check in and help us to check with our package cause we wasn’t sure our room included breakfast!  We were stayed in the second highest floor ( lvl 29 ) ! Woah ! The room itself is pretty cozy and I loved the decoration of their design with the bathroom! Is an open window where u can see the city when u are taking shower ! 😂 Very unique and fascinating plus they provided big bottle of shampoo unlike other hotels. I would also like to thanks “ aidil “ when we were entering the restaurant for the breakfast with his friendliness and services  ! Overall, it is a good place for staycation! Would recommend to my friend for this hotel !…",50,Apr-21,Travelled with family,12,0
Good stay at Yotel,"Had a relaxing stay at Yotel Orchard. Nice view,good gym and relaxing pool. Staff are kind.Room is clean though small.No sofa  but small chair. Very convenient location next to Shaw centre,lots of food options and shopping.Isetan,Wheelock nearby. The cafe on 10th floor is ok ,discount for hotel guests .Had a queen bed but prefer twin beds, since staff very kind to give me a lovely view room ,I was happy !!",40,Apr-21,Undisclosed,1,0
Poor Quality Bed and Mattress,"The bed and mattress quality is really bad.  We even tried to sleep with heads on the other end as it is slightly flater than the headside.  We decided to check out about 2am plus, as we were unable to continue using the Smartbed.  To be honest, a good and comfortable bed is the basic for a hotel. This Smartbed fails very poorly in this aspect.   The mattress sinks in on the edge and si­des, does not provide support, same thing for the pillows. The quilt material al­so makes it uncomfor­table to use.  This is something the hotel should review if it wishes to pr­ovide a good stay for the customers.  And we decided to skip the breakfast too even though we had paid for it for 3 pax.  Overall, a very negative experience Staycation at Yotel Singapore!",10,Apr-21,Undisclosed,1,0
YoTel Orchard,"Room was clean, tidy n neat. No cigarettes smell. Walking distance to eateries n shopping in e heart of Orchard.  Yolanda n Yoshi, e stars of YoTel, should tried out using them to deliver ur material water or towel. ",50,Apr-21,Undisclosed,1,0
Quiet and peaceful right smack in Orchard Rd,"Affordable. Excellent location. Walking distance to shopping, eateries and just to people watch. 24hrs cafe nearby. Covered walkway to shopping centres. Cool cabin with the right aircon temperature. Water pressure for showering was amazing. Had the most peaceful sleep. ",50,Apr-21,Undisclosed,9,0
Excellent hotel,"Excellent location being at the heart of the city. Near shopping malls and mrt. Clean, quiet, value for money. Offers early check in which is is a good offer, like stay been prolong for free. Thanks everyone, thanks to all the staff",50,Apr-21,Undisclosed,1,0
Value for money and everything u need for a short staycay,"I actually really liked the YOTEL concept of ""taking the essential elements of luxury hotels into a compact, but smart space"". They have 2 other YOTEL concepts as well - YOTELAir and YOTELPad targeted at different type for travellers. I admit that this is not exactly a staycay property to lust after but I figured if I didn't mind so much the 10SqM YOTELAir room back in 2019, I definitely will survive a 14SqM.   Location - Nestled right behind / alongside Isetan Scotts / Shaw Centre on Orchard Road, the property is a little hidden from the madness of the shopping belt yet smack in the middle of everything. You have Orchard station (NS22) about 5mins sheltered way away for public transport and numerous bus services which stop besides.   Price - $150++ booked under the Stay Yo Way,…",40,Apr-21,Undisclosed,2094,290
Perfect Location and comfortable rooms,"Location was perfect and it was a short walk away from the orchard underground linkway to various malls, pretty much sheltered all the way too. Rooms are quite small but comfortable, more suitable for staycay people who don’t need much space or don’t stay indoors all the time. Be careful when taking up their early check in request as encountered their staff biting back at me for checking in early when I requested for late check out as my family and I are heading out on check out day and was afraid might not come back in time to check out so asked as a precaution.",40,Apr-21,Undisclosed,2,0
excellent and enjoyable stay,comfortable and cozy room with great lightning in room. Huge window for city view and good ambience to enjoy a shower with those stunning view. Despite room size is smaller then average but many factors overcome this tiny down side. ,50,Apr-21,Undisclosed,2,0
3D2N Staycation,"Hotel location is convenient walking distance to Orchard shopping. Rooms are too small but compact which want we need, only thing not comfortable is the mattress and pillows too soft (should improve on these). Service crew are polite and friendly ! If got promo don't mind to come again.",40,Apr-21,Undisclosed,1,0
Yotel Experience,"Overall experience is ok. Good location, clean, great staff & new experience with robot. Just room is really small and not worthwhile to upgrade. Not suitable for family with young kids unless you are willing to pay for experience. ",40,Apr-21,Undisclosed,5,0
Staycation,"The room is clean. For location wise, it is very accessible    to varieties for food. Located near to shopping malls and Orchard MRT as well. The staffs were very friendly. Checking in/out is very simple. would consider to come back for another round for staycation.",40,Apr-21,Undisclosed,1,0
Recommend to stay here!!,"Checked in on good friday. Took around 2hrs to check in due to the long queue..Room is very clean i would say, everything is working well..bed is cool able to adjust. Easy to connect laptop to TV with HDMI cable to watch youtube & disney+. Room is just nice for 2 pax, would definitely book here again!",50,Apr-21,Undisclosed,1,0
staycation value hotel,No complaints on the location. It is very assessable to all big shopping malls.  The room is pleasant. good for solo or couple staycation the view is great due to the high floors. the internet is stable and fast.  ,40,Apr-21,Undisclosed,1,0
Staycation,"Booked this hotel after reading the many good reviews left by guests.   Many thanks to the hotel to accommodate our request for adjoining rooms, the early check-in, and the birthday surprise delivered by Yolanda.  Many thanks also to Eswari and Aldrina for the patience shown in clarifying the parking charges. S$21.40 for a single-use exit pass regardless of the number of hours/days stayed.   The location of this hotel is very good. There are many big shopping malls and food establishments right beside it. The MRT is very nearby too.   The room layout is somewhat unconventional with the bathroom located right against the exterior windows. This means guests have to choose between privacy or good view and natural light.  It also means lots of curtains up/down. It will take some…",50,Apr-21,Undisclosed,37,5
Cool get away right in the heart of orchard road,"Great cool hotel for a staycation.  It is so convenient to walk everywhere on orchard road!  Though the room is a little small, the high floor makes up for it!  The breakfast was straight forward and quick service!  I love to hang out for drinks another time!",40,Apr-21,Undisclosed,17,10
"Nice Views, Uncomfortable Bed.","Views of Orchard Road were nice although it was troublesome to have to lower the blinds every time I needed to use the toilet.  Although futuristic, I was very disappointed by the bed.  When it was flat, I could feel a depression where the 'bend' of the mattress occurs.  It led to a very uncomfortable night's sleep.  For those who are sensitive to their mattresses, you may want to give this place a miss.",20,Apr-21,Undisclosed,27,25
Awesome cosy hotel,"Awesome team at hotel. Complementary early check in and check out via self service touchscreen.  Clean and cosy room. Near Orchard MRT, Shopping Mall and cinema. 24 hrs cafe round the corner and 24hr convenient shop near by. Decent breakfast",50,Apr-21,Undisclosed,1,0
Enjoyable stay,"The hotel is suitable for family. The location is fantastic. I would definitely recommend to my friends and family. Will come back again with my family. Although the room is small, it is cosy and compact.",40,Apr-21,Undisclosed,1,0
Bed that moves,"Soft beds, breakfast not fantastic, gym size can put about 5pax, love the complimentary early check in, nice staff and free flow of water. Bed can be adjusted up and down with button, sensor lights for the room, know how to light up when you wake up, cabled tv channels but not smart tv, rain showers, good amenities ",30,Apr-21,Undisclosed,29,25
Hotel review,"I love how the hotel are just walking distance to the shopping malls. It is super convenience, cozy and totally love the view. Would definitely recommend this hotel to my friends. I wouldnt mind coming to this hotel again!",40,Apr-21,Undisclosed,1,0
Will definitely come back,"Love the view at night from the shower area. Efficient layout for a small room roughly 14-16sqm. Amenities will good. Towels are clean, sheets are clean, bed are super soft. Its a happy place with purple grey theme. Similar to M social but much better.",40,Apr-21,Travelled as a couple,29,8
Yotel Staycation,"It was a convenient and not over-priced hotel to consider within the heart of Orchard. With minimum contact, they have 2 cute robot, Yolanda and Yoshi to do the errands. Room is just big enough for 2 to 3 pax. Otherwise get the bigger room.",40,Apr-21,Undisclosed,3,0
Nice hotel,"Overall the hotel room is quite decent. Staff are extremely friendly and quick to attend to your enquiry/request. Amenities in the room are fantastic, they have everything that you need like iron & iron board, umbrella, shampoo, conditioner, body wash, body lotion and hand wash.",40,Mar-21,Undisclosed,1,0
Awesome Stay @ Yotel SINGAPORE,Complimentary Early Check-in.. Very Clean Room - Thank you to the Chambermaid who cleaned up & prepared the room for my check-in.. 😀 Friendly & accommodating staff all around.. 😄 Super cute Yolanda & Yoshi... 🤣 Room Amenities are well stocked up & good... ☺️ Western Cold & Hot Breakfast range is Big & Yumms 😛,50,Mar-21,Undisclosed,2,0
Staycation,"Hotel room was cool, I like the robots sing bday song for me, the city view was nice, the toilet floor is slippery after shower, the bed is recline so it’s new experience, but the blanket is full of dust fibers especially when we sit and move the blanket fiber dust start to floating around the air.",30,Mar-21,Undisclosed,1,0
"14m2 small room, shower silhouette transparent glass, aircon 21 to 24 degree, BF takeaway, No Free Parking","The hotel is newly built in 2017. There are 610 rooms. Parking is $20 per day or $3 per hour entry. There are 30 floor. Room temperature can only be set between 21 to 24 degree. You can ask for extra towel, mineral water, shaving kit again. Reception lobby and drop off area is located at level 2.   During check in you have to scan the qr code. Then the staff would direct you to the counter and assist you to check in. Need to fill up form and write in your full nric number (not last 4 digits) and date of birth. This is for all guests and visitors. Room floor and room number is already assigned to you. Similar to airline self check in system where you can't choose the floor or room. The lobby is like a touch and go station. No seat or sofa like other 4* and 5* hotels in Singapore.…",30,Mar-21,Undisclosed,8538,415
Thank Yo!,My family and I enjoyed our stay and we appreciate that we were assigned connecting rooms. That was a nice touch. Thank you for the complimentary early check in as well! We got to start our plans early. Wouldn’t mind making a second trip to Yotel in future. :),40,Mar-21,Undisclosed,1,0
1 Night stay at Yotel,This is one of the nicest hotel I've been in and I've stayed at expensive five star hotels before. Of course you shouldn't expect the greatest facilities or a huge room for the price you're paying. But the room is frankly amazing. I will definitely be coming back here,50,Mar-21,Undisclosed,1,0
G8 breakfast served by g8 waiter,We were very impressed with d way breakfast was served as we did not have good service or food at Carlton Hotel.We were served by mdm Eileen who anticipated our needs even before we asked. The staffs at reception are very young but respectful.,50,Mar-21,Undisclosed,1,0
Staycation in March.,Generally ok. Cups for brushing teeth not provided. Wireless screen mirroring intermittently disconnected. Wash basin outside toilet and shower require additional time to get used to. Room service for cleaning is provided only upon request.,30,Mar-21,Undisclosed,3,0
Best bang for your buck!,I would like to express my sincere gratitude to the team especially Shahrul whom arranged for an upgrade as me and wife were celebrating our anniversary together. He was extremely nice and pleasant to talk to. Thank you very much for making our stay as comfortable and smooth as possible. It's only a day and we've already missed Yolanda and Yoshi! They were really helpful!,50,Mar-21,Undisclosed,1,0
Futuristic hotel,"Enter next to Thai Embassy.    Swift check in and out. Room is small but sufficient. Retractable (hospital type) bed to save space. Safe provided. Ample toiletries, coffee tea, bottled waters in room. Clean sheets and towels. Full length window through the bathroom.  Lots of food and marts around hotel. Room service by robots. Cool, though not interactive.",50,Mar-21,Travelled with family,215,134
One of the best staycay experience.,Overall our 3D2N staycay experience was splendid and we enjoyed our stay in Yotel greatly. It was value for money and location is great as well. It was a birthday celebration for my partner.  We are thankful for the complementary early check in given and the great service by the staff. The room is small but we are not bothered by it as the toilet make it up for space and view. A robot- Yolanda came up to sing my partner a birthday song with macarons and card signed by the staff.  The gym experience was just good as well. It was an enjoyable stay and we would love to come back again next time. We love the robot too. :) ,50,Mar-21,Undisclosed,2,4
Staycation with friends,Quite as okay hotel for its price. But the shower is not suitable for 3 people. Should at least provide an extra blind outside the toilet to prevent others from looking inside while others are showering. As people may mistake this as a hotel made for couples for other purposes.,40,Mar-21,Undisclosed,1,0
Not value for money,"Choose the hotel as we have errands to run in orchard and the price was within budget. However, in the end we paid $40+ for parking. Which we can stay in a better hotel. No housekeeping done when we were out. Overall, not value for $ and definitely our last visit",10,Mar-21,Undisclosed,2,0
Staycation,"Good location in orchard. Very accessible to ion, taka, shaw, tangs and many more. Room was very small. Cool bed. But room service need to improve. Requested for 2 face towels, waited for more than half an hour. Need to call a second time then send over 1 only. Should include the face towels in the room. ",30,Mar-21,Undisclosed,2,0
"Good location, efficient use of space, value for money","Excellent location, just behind main Orchard Road shopping belt. Hotel and interior furnishings looks new.  Rooms though small but efficient use of space. Despite lower price for Singapore hotels, still provides most amenities including toiletries, hairdryer, iron & ironing board, water boiler, safe and small fridge. Toilet is of good size, no need to shower beside the toilet bowl getting it wet and enough leg space in front of toilet bowl.  Wifi is easy to connect and fast. TV has free to air channels and many cable channels. You can also cast from your device to it with simple instructions on the TV provided. There is also a HDMI port on the wall beside the bed though I did not try it. A number of power points and USB power ports provided around the room.  Front desk staff…",50,Mar-21,Undisclosed,1,0
Excellent YOTEL Experience,"Checked into this property with the purpose of having it as a staycation session for my boyfriend and I. We stayed here for 2 days and 1 night (checked in on 23/03 and checked out on 24/03). The rooms are beautiful, cozy and neat and the location of this property are conveniently accessible for transportation, shopping and for looking for food places. Also, their lift lobby are lit with the neon lights which are so pretty and the hallway suits the scene for filming a horror movie. Highly recommend this property and will be back there someday!",50,Mar-21,Undisclosed,1,0
Short staycation,"Location is great, right in orchard area. Bed was a little too soft for me. hotel is clean, staff are attentive towards my needs. overall, still enjoyed my stay here. price is reasonable, will come back again.",40,Mar-21,Undisclosed,1,0
overall,great place to staycay & the facilitiee is great over there too. had a very exp for two days and would totally recommend people to come with their family & friends. the facilities & amenities is great too.,50,Mar-21,Undisclosed,1,0
Perfect short stay,Perfect location with wonderful service. The check in staff even noted it was my birthday month and had Yolanda (the robot) sent up some cookies. Nice touch to a pleasant evening. Will definitely stay here again.,50,Mar-21,Undisclosed,1,0
Simple Staycation,"Wanted to simply stay here due to the robots. Specially called to request for some small items to be delivered to us and I can say definitely the highlight of our trip.   Room wise-we know it is small. 3 adults to move around, it is a squeeze...but can’t complain as we know that’s what we have signed up for. Bathroom was okie, just that I think you need to be highly comfortable with one another as somehow, you would be able to the a bit of the silhouette of the person in the bathroom. At least it wasn’t an issue for us.   Bed was very soft. Need to find spots with not so soft bed. But number of pillows was definitely enough.   Highly recommended if you only need the hotel to sleep and rest. If you want to just stay in the hotel to enjoy the facilities...then I would choose other…",40,Nov-20,Travelled with friends,114,22
Cool hotel for a short staycation,"Since we have not utilize the SRV vouchers, we thought it would be nice to book a short staycation before the school reopen. I came across Yotel Orchard, which is in a nice location in Orchard, and it seems like a cool hotel, with the futuristic theme. The price was reasonable considering, it can sleep 3 persons and come with breakfast as well. We arrive slightly later at 3pm to check in, and there was no crowd in the lobby. We used the mission-control (manned counter) to check in, and pay an additional top up for the overnight parking which came up to be $21.40.  After checking in, we went to the 10th floor to book the time slot for the swimming pool. The pool is quite small, and with children playing in it, you have to watch where you swim.  The room was nice and clean,…",40,Mar-21,Undisclosed,33,58
Very Cool hotel,Located in the central area of orchard. The room is so cool. Breakfast is limited choices but it tastes yummy. The mission control team sent the robot to sing the birthday song for us which is so memorable during the stay. Thanks Yotel.,50,Mar-21,Undisclosed,2,0
Room was extremly small,"First Class Queen room - The Room was extremely small, not worth the price paid. There wasn't enough space to even open my luggage. The room was very small, the bathroom was extremely small. And the deck is not clean.",10,Mar-21,Undisclosed,1,0
Housekeeping can be better,"The bed is quite comfortable but the space is a bit cramp. If booked 2 rooms with connecting rooms, the interconnect doors are not able to stay opened. There is no stopper provided. The location is quite accessible to F&B outlets, however quite a walking distance from Orchard MRT station. Do check out the expiry dates of the items in the room, as some may be expired or near expiry. The overall staying experience is just ok.",30,Mar-21,Undisclosed,2,0
My Staycation,Enjoy my staycation. First time i book this hotel. The bed is very comfortable...can watch my favourite korean show..they provide hair dryer n ironing stuff. The shampoo n conditioner is a quality one. Hope to comeback again. ,50,Mar-21,Undisclosed,1,0
Early birthday family staycation,"Thank you team Yotel from the front desk to the komyuniti restaurant team. Everyone was helpful and took great care of my family with my mother in the wheelchair.  We got early checkin as our connecting room was ready about an hour before the scheduled check in time. Received a sweet surprise from Yolanda for our birthday boy and enjoyed the pool for the 2 nights stay. Proximity to amenities in the surrounding area means no shortage of food and activity...we even caught a midnight movie on our last night stay. And singapore being so efficient, everything was a grab away. But once again thank you team Yotel. You guys are awesome. My mother and kids gives a sign of approval so we will definitely come back. Highly recommended. Ps, remember to bring down the blinds when you want to…",50,Mar-21,Travelled with family,58,14
"Bad service, YOTEL orchard, Singapore","Reason is simple, made a request for check out at 1pm was rejected. And then when I ask how about checking out slightly after 12noon, even like 1205, person name Sahrul on the phone at the front desk say NO.  Enough said for NOT accommodating for simple request",10,Mar-21,Travelled with family,2,0
No more than 2 nights here,"If you are planning a family staycation for 3 (8-10yo) and are able to and willing to afford the First Class suite for 2N ( no more ) this is an option. Suite is ok for 2.5 people no more than 3 adults, windows are ceiling to floor in the showerstall so lower those blinds or prepared to flaunt what you got! Be either early (before 8am or after 955/10ish am to avoid breakfast crowd) as minimally staffed. OK for the one off experience but not Round 2 for us.",30,Mar-21,Undisclosed,1,0
SmartTech and Comfort in 1 Cabin,"Check-In was done in a swift. Staff at Mission Control was really friendly and explained clearly on the details, clauses. Room service was also efficient, met Yolanda, the robot :D Definitely made my day. Called in to Komyuniti to order some food to dine in the room before checking out. Despite several return calls due to some technical issues, not much delay to my hungry stomach, kudos to that! Food quality was good and thanks to all the prompt and good service, it made my staycation a really good one. Will definitely be back again!",50,Mar-21,Undisclosed,1,0
A GEM in Orchard Road,"We booked a family room with view and stayed for one night. TThe location is fantastic and we used it as our base to explore the area.  A lot of eateries and shopping ccentres.  Been to many places particular Emerald hill,  Orchard gateway library and wheelock 卓尔bookshop. ",50,Mar-21,Undisclosed,17,3
Happy with my stay,"Check in was relatively easy. Acdonia (can’t rmb exactly) was very helpful and friendly and full of smiles. Cabins are small but location is good. With rediscover vouchers, definitely made it value for money. ",40,Mar-21,Undisclosed,1,0
Great experience at YOTEL !,"The staff service from the reception area to restaurant was great ! Hotel WiFi was fast and automatically connected. The room was cosy, compact, very clean and well equipped with amenities and we were impressed by the special delivery by their cute robot, Yolanda.  ",40,Mar-21,Undisclosed,1,0
