Yotel,"Enjoyable stay but the bed is very soft. Staff is very friendly and location is excellence. Room is decent size for the price. Breakfast food quality Overall , will definitely visit this hotel again . ",40,Aug-20,Undisclosed,1,2
Room size,The special type of bed is not comfortable to have a good sleep. Room size small and luggage have to be kept under bed. Hence if u have a big luggage. You will find yourself difficult to maneuver around.,20,Jun-20,Undisclosed,3,4
good location but not suitable for me,didn’t like the “special” bed - we both ended up not having a good sleep and woke up with back ache. also didn’t enjoy the hotel breakfast.  service staff seem nice but overwhelmed. self check in didn’t work for me. chrome cast didn’t work for me either. I wasn’t informed that the gym and pool were reopened already (was advertised as closed previously due to covid-19 sgclean) so i did not prepare stuff to enjoy the facilities.  oddly this is a booking that did not remind me via email one day before my actual trip and i also had problem viewing my booking confirmation on my yotel account. had to write in to them to confirm.   if you really need to stay in orchard road then this works.,30,Aug-20,Undisclosed,5,15
Guest Friendly Hotel.,"Hotel is located in an ideal location to many eateries, shopping malls, cinema. Close proximity to MRT. The hotel.prices can be steep during peak season as compared to other hotels in orchard. Overall stay is great!",50,Aug-20,Undisclosed,4,8
Need to at least try,Table not wiped for months. Musky smell. AC not cold. Ventilation not flow. Previous guy shower moisture still there. Fridge have somebodys bubble tea not removed. Bed creaks badly. Mattress sinks easily no support. Paid sgd420 for room. Am sure sgd80 hotels do better.,10,Jul-20,Undisclosed,1,2
Cool hotel,A cool hotel to be in if you do not mind a smaller but cozy room (cabin is what they called!) Although breakfast is lack of variety but has a good portion. ALL Staffs team are smiley and friendly 110/100 marks for them! Toothbrush is upon request and get ready to be greeted by their robot with the toothbrush inside him! ,40,Jul-20,Undisclosed,1,2
Great Hospitality and service,Great room with friendly staff but disappointed that the robot was not used for room deliveries but overall experience is very good. my booking was for the First class queen and was given a room with a fantastic view on the 30th level room 3021 but i wont recommend this room due to the noises during the day from the roof but was told this is the best room with the best view in the hotel.,50,Jul-20,Undisclosed,49,48
Great stay!,"location is great, in orchard and pretty easy  to find as well.  room is clean and cool. bed is super comfy and good to sleep in. lights are bright enough and has the essential amenities. toothbrush however wasnt in the room, only upon request. would highly recommend and stay in this hotel again ！",50,Jul-20,Undisclosed,1,2
Well located design hotel with cramped room,Stayed 3 nights in this nicely designed minimalist hotel located just off Singapore’s main shopping street. Unfortunately the space in our room was too cramped especially with the extra suitcases we had. ,30,Jul-20,Undisclosed,2,4
Once you get past the room size its a very nice place,WE were surprised at the very efficient use of space. We live in a Motorhome so it seemed normal to us.Neat clean and efficient. Staff was helpful and lobby was a little distant but functional. Great location in this high priced city.,50,Mar-20,Undisclosed,281,97
Quirky place with outstanding location on Orchard Road,Overall a very good hotel. Check in can be a bit fiddly if the self check in system throws a bit of a wobbler! We had the suite on the top floor which has outstanding views of Singapore. Very spacious and well thought out.,40,Mar-20,Undisclosed,34,52
Clever use of space,"We really like this clean hotel, had a great view of the city from the balcony, really clever use of space especially the electric bed that moves up to create room and then flat to sleep, amazing! It’s in a great area for shopping and eating, but quite hard to find on foot with cases from train station.  A tasty and good selection of food and drinks at breakfast.  Didn’t get to see the room service robots in action, maybe next time. ",50,Feb-20,Undisclosed,34,46
Cozy purplish stay,"Perfect location situated around Orchard Mrt, walking distance to International Building then behind is Yotel. It’s quite confused that need to see the direction signs. Must prepared that booked is a cabin size yet the compact room is really amazing tidy! Adjustable bed so comfy, shower was great! Just a leg away to any~ Not good for bulky luggage. The robot so adorable coming your room when u request for things. The breakfast is yummy great with egg station & wide variety. A window away is outdoor long pool. ",50,Sep-19,Undisclosed,87,57
Stingy on drinks,"You would think they would be elated to have any customers but the OJ I ordered was only 2/3 filled whereas the other drinks from friends were filled to the brim. otherwise, nice amenities, good breakfast which comes free if you book your room from the hotel/s own website. the selection is decent and the portions generous. the room is very clean and the toiletries very fragrant. the bed was too soft as it is not spring supported so you sink into it at night. bad for the back. also not much room to hang stuff if you have 3 to a room. we had the one with the bunk bed so it was a bit crammed. the robots are very adorable, suggest you try sending up something just to experience it. receptionist was quite dismissive at first and waved us away to use the computers instead of giving a…",40,Mar-20,Undisclosed,46,16
VIP King Suite - AMAZING,"We stayed in the VIP King Suite and have to say that it was amazing - we did not use the kitchen or dining area, so a waste of space really - although we really wanted a larger room as knew the normal rooms were so small. There were lots of storage, 2 x fridge, 3 x bathroom sinks, 2 x balconies - we could not have asked for more. It was spotlessly clean and the housekeeping were amazing - I know in this hotel if you do not have housekeeping you can save $8 per night, although when you are in a room 4x the size of a normal room - then you would expect to save more then $8 a night. The views from the balcony were just incredible. The location of the hotel is also a plus - you just can’t beat the location. The Roberts were also amazing and would bring unlimited water to your room.…",50,Mar-20,Undisclosed,109,186
Singapore at it's Finest,"We arrived at 6am on the early flight from Australia and to Yotel by 7.45 am and we were allowed to check out luggage in and told we could return at noon to check into our rooms. For a fee of $114 each room we could've checked in earlier.  Check in was easy with our passports and credit card for room security hold.  Upon return at noon they took our luggage up to our rooms and we found that even though the room was quite small the use of space was amazing. We had the upgraded room with balcony.  They bed was comfy for the first night (I think after 38 hours being away anything would have been) but the second night it was easy to see the memory foam was use to people sleeping in it as the ""hump"" in the middle of the bed was quite large. I still found it comfy but my partner…",50,Mar-20,Undisclosed,20,23
A unique experience in a modern hotel,"The hotel is clean and boasts of modern chic. I am very particular about the cleanliness and comfort that hotels can provide and I like how this hotel was able to give us an excellent service and a comfortable stay. The room was compact but they were able to make all the spaces functional. I liked the view from floor to ceiling window; however it is also on the bathroom side of the room and we had to pull down the blinds most of the time. But it was a unique experience. We loved yoshi and yolanda too. It was intriguing to see these robots going about the hotel. I also loved how the hotel is strategically located; it was near bus stops and just a short distance away from malls, restaurants, and convenience stores in Orchard Road. Loved the hotel. We will definitely come back here.",50,Feb-20,Undisclosed,1,2
Clean & Tidy but rooms not for the claustrophobic,"Very small room/cabin with bed that partly retracted back into the side wall to make space.  Clean and tidy with typically modern facilities.  Ludicrous positioning of the toilet by the window, necessitating drawing the blinds every time you need to use it.   The hotel is in a good position in the town close to many bus routes and the  MRT.  This hotel is probably more suited to the business traveler.",30,Jan-20,Undisclosed,98,104
Excellent property and staff but disappointing sleep,"The hotel is awesome. From the friendly staff at Mission Control to their restaurant and the novelty and convenience their 2 robots bring. The rooms were clean and the hotel was designed well. However, the disappointing comfort of their bed and pillows caused their rating to drop. The pillow was way too soft for my wife and I while the mattress seems to have a dent on my side of the bed that made me have backaches on top of my neck and shoulder aches the pillows gave us.   All in all, if the bed was done up to our preference and we are able to have good night's sleep, this property will definitely get a 5* rating. ",30,Mar-20,Undisclosed,4,8
Excellent Little Space in the City,"I can be picky with hotels bc we have stayed in a lot of them.  I loved this one because of the bed and coziness of the room.  It is just the right size to feel like your bedroom at home.  In addition, the bathroom is creative, they have yoga on tv, the channels are great, and the location is central.",50,Mar-20,Undisclosed,8,17
Short stay,"Staycation with the children to experience the uniqueness of the hotel. Was greeted by two adorable robots Yolanda and Yoshi, the kids were intrigued. However the breakfast selection could be more , otherwise the quality and freshness of the food was good.",50,Mar-20,Undisclosed,6,14
Cool experience in a tiny cabin,"Nice experience in a modern and well located hotel.Too small rooms with nice views in the high floors. Breakfast could be better, I found it was nothing special. For a hotel like this I expected something nicer.",40,Mar-20,Undisclosed,2,5
Nice stay,"It is a clean and decent hotel to stay. Hotel is close to train station and shopping areas which is very convenient. With lots of restaurants and drinks available around the hotel, I enjoy my stay here. ",40,Mar-20,Undisclosed,5,2
Holiday trip,"Great location of hotel, good quality breakfast, new rooms, quiet rooms and special motor beds. Small rooms, quit small pool area and poor self check in process. Singapore is nice clean and safetytown and with metro/bus easy to travel.",40,Mar-20,Undisclosed,1,2
Small but functional rooms,"This is an interesting site mostly aimed at young travelers. We are old but found it to be well designed and a pleasant place to stay, The rooms are small but you can still walk around and everything is well organized.",40,Mar-20,Undisclosed,196,98
Really Good Value for Money ,"We stayed here twice (at the start and end of a month-long trip around SE Asia) and thought it was great value for money. The location on orchard road is excellent; close to shops and the MRT so we felt like we had everything around us, or at least access to it if we needed.   The facilities are good - we used the gym and pool and they’re better than most lower budget hotels, and again the room (we had a premier queen with city view) had everything we needed. It even had an iron and ironing board (we even used it!) and the bed tucking away a bit made even more room. The rooms are not massive but we’ve stayed in much smaller rooms in Tokyo and New York (and in NYC you pay much more!) so comparatively the space is almost palatial!  The only criticism I had was the privacy of the…",40,Mar-20,Undisclosed,23,51
Very trendy hotel on a good location,I liked the stay in Yotel a lot ! Nice atmosphere! Nice breakfast with friendly staff! I enjoyed their awesome swimming pool. Certainly try the robots Yoshi and Yolanda there: they bring water and towels to your room when you need it. You fall in love with them immediately:). Very close to food markets Newton and Zion where you can eat very cheap but delicious local food.,50,Mar-20,Undisclosed,15,32
Perfect stay,"Everything was excellent. Highly recommended for single and couple. Perfect spot for Singapore. If you want a good stay with cool people then take the yotel hotel in Singapore. Nice staff. Really, everything was perfect. Thanks.",50,Feb-20,Undisclosed,6,13
Perfect location for a short break in Singapore,"A very quirky place to stay, with fully featured small, immaculately clean rooms. The bed in particular was exceptional! The robotic room service offered by Yoti and Yolande is something not to be missed.",50,Mar-20,Undisclosed,2,4
"Great stay, great place",Top draw. Clean and crisp hotel with some interesting robotics. Tres ergonomic and efficient with space without feeling small. Really lovely shower with floor to ceiling windows and an amazing view of the city.,40,Mar-20,Undisclosed,1,2
Stay at Yotel Singapore,"We loved our stay at hotel! Location was very good since everything was close by shopping malls, metro station etc. Hotel was overall clean, modern and was easy to find everything.  Room view was amazing since we had a queen view room from the 29th floor. A bit smaller room, especially when travelling with big luggages but very clean and had everything you'll need for your stay.  Staff was very friendly and was there to help!",50,Mar-20,Undisclosed,2,4
A very unusual experience,"Excellent location, close to Orchard Road, with easy  access to the wonderful Botanical Garden, and numerous shops and restaurants in Orchard Road area.  New hotel with a very unusual concept (discovered this at check-out) .  Not for people who appreciate space following a long flight, unless staying in a flight cabin is of particular pleasure to you. Room clean, neat and tidy but claustrophobic with all the standard in-room amenities. Good for people who prefer short stay, ready to roll out of bed and go. Not suitable for bigger size person or couple, unless you are prepared to pay for 5 stars service.  ",30,Feb-20,Undisclosed,19,49
hotel in an excellent location,"hotel located in the middle of Orchard Road. lots of dining places around hotel, will never go hungry staying here. swimming pool is abit small though but is fine if its just for a leisure swim. room is small but cosy. bed is cosy too, wish for a bigger sized bed if possible.",50,Mar-20,Undisclosed,16,33
Great day's in Singapore.,We were 3 days in Singapore and it was wonderful. We traveled by metro with tourists card. Traveled to Chinatown and that is great to be there. Visit Sentosa by cable car and the view is wonderful. Only prices on Sentosa are high.,50,Mar-20,Undisclosed,1,2
TERRIBLE HOTEL,"If you want cramped tiny rooms at exhorbitant prices, then this is your ideal hotel to stay at.  Robots are a huge gimmick, get in the way of real life people trying to access the lifts.    AVOID LIKE THE PLAGUE.",10,Feb-20,Undisclosed,1,2
Excellent Service and Perfect location,"We Stayed in the Yotel for three Nights for Stopover. The Hotel is perfectly Located, the rooms are More spacious Than thought and the Service is More than excellent. Please Choose this Hotel. We were 2 adults and 2 Kids (2, 5 years) and stayed in a triple with view. Thanks a lot to the whole Yotel Team! ",50,Feb-20,Undisclosed,1,2
Great location but very small rooms,"The hotel has a great location but the normal rooms are very small. Smaller than rooms in Japan. The hotel is clean and the staff is super friendly. Considering the price of food in Singapore, the price of breakfast buffet is good.",40,Mar-20,Undisclosed,2,4
Loo with a view!,Room was small but has everything you need in it. To make room the bed withdrew. Very clean and if you didn't want the room servicing you got a credit of 8 SD to use in the bar or restaurant. Breakfast excellent - very good choice. Location a little out of the way but MRT only 5 minutes walk.  All in all for us staying 3 nights a good choice.  ,50,Feb-20,Undisclosed,22,47
A positive overall experience,Small rooms as designed and unique having the floor to ceiling windows in the bathroom but very clean co for table and in a great location with helpful staff and amenities. Excellent location and convenient for transport,40,Mar-20,Undisclosed,14,23
Clean,"Nice and Clean place, very polite and nice enviroment.  It was really comfortable and cozy, as i stay with my friends for malaysia and they really love it. They will come to singapore again and stay here for more nights.",50,Dec-19,Undisclosed,2,4
Kiwi,Rooms were clean and well presented but a little tight for space especially around the washbasin You can hear the water running through waste pipes during the night which is annoying. Great location and has good clean facilitiies.,30,Feb-20,Undisclosed,1,2
Tech savvy hotel,"Even though I didn't manage to check in via the self kiosk station, but the entire stay was awesome. Cabin was squeaky clean. They provided huge bottles of toiletries instead of the usual small toiletries bottles. Room service was great too! Instead of usual human room service, we were served by robot, Yoshi. For their bed, it's adjustable from lying to sitting up, like a hospital bed, hahaha! But it was comfortable. ",50,Feb-20,Undisclosed,6,13
Excellent Location and Helpful friendly staff,"Yotel hotel on orchard road is a good place to stay, nice location. Staff is very friendly and helpful. Close to MRT station. Lots of restaurant and bars nearby. I love the robots in the hotel. Airport is around 25 to 30 mins by Car.",50,Feb-20,Undisclosed,1,2
Small but cozy!,"The room is small but its really comfortable and cozy. Bed is adjustable and really soft. Located in town area which is really convenient. Dinner was really yummy at their restaurant, had Brussels sprouts with bacon and also pasta carbonara. Yoshi and Yolanda (autonomous robots) is really cute!",40,Feb-20,Undisclosed,2,3
Nice hotel in a central aera of Singapore,"The Hotel is located in a central area of Singapore, the rooms are clean and even if they're small they are prefectly functional,  the staff is very friendly , the breakfast is excellent and the price is good",40,Feb-20,Undisclosed,20,39
Excellent staycation,I stayed for only one nite to celebrate my birthday. The location is good. Room is clean.Very cool lift with nice music. Breakfast is nice...try their meehoon. Super nice! Super value for money. I will come back again.,50,Feb-20,Undisclosed,1,2
Definitely recommend!,"We stayed at this hotel for 6 nights. Although yes small, it was the perfrct size for two of us and everything in the room was modern, comfy and clean.   The hotel ended up sending a robot up for my birthday and this was such a lovely surprise. They were also overly helpful and happy to attend to any needs whilst we were there.   If you're looking to see all the awesome things in Singapore, and to stay at an awesome modern hotel with the BEST location to do it, Yotel is the one!   Thank you for making our stay just that much better.",50,Feb-20,Undisclosed,1,2
Comments & Improvments,Personal view and suggestion for improvement with regard to the services provided and the way check in and out from the hotel....there are still people not very familiar with electronic check in and out...should be dual methods of check in and out,50,Feb-20,Undisclosed,1,2
"Clean , trendy and well located","My second stay here. Enjoy the cleanliness and peacefulness while still being close to metro , food places and shopping. Room cleaning is always quite regular so you can plan around it. Room soundproofing is quite good so easy to nod off to sleep. ",50,Feb-20,Undisclosed,1,2
"Design, simple,  usefull & friendly  atmosphere","i have appreciated the cool atmosphere, the design style and the practicity . Morever the view can be impressive (from the high floors)  The location is central It's easy to go everywhere from the hotel",50,Feb-20,Undisclosed,2,4
"Central, clean, modern, simple ","I stayed at Yotel for one night on my way back as I flew out of Singapore after a trip. Rooms are small, but modern and enough if you plan to explore the city and don’t want to hangout in the room all day. Toilet and shower are one with an incredible view over the city. Actually it’s a large shower with a toilet. The hotel is right on Orchard and therefore all shopping possibilities are around the corner. Everything else is good to reach - cabs are reasonable in Singapore. The cab to the airport was 20 SD. Also used the gym which is rather small and feels full with two people working out. Over all a good stay though. ",40,Feb-20,Undisclosed,32,38
My trip to Singapore,"This recent trip to Singapore, my son was arrange everything including hotel selection. This hotel is much different from what I used to 10 years ago. No bell boy, no official check in counter. You need to do your self with the assistance of hotel staff. I like Robot, it is first time I see this kind of service. Quite impress. ",40,Feb-20,Undisclosed,1,2
Great location,Very Clean hotel in a good location. Lovely breakfast woth plenty of choice and a very quirky hotel. Staff were great and very helpful and i would recommend this hotel would definitely stay here again. ,50,Feb-20,Undisclosed,18,28
Good Location But Room is Small,The staff at the front desk are polite. I was at the hotel in the morning around 9am and had to leave my lugguage with them. After the necessary paperwork he indicated all is good. I asked if I can get the room key around 1pm and had to ask if they will pass me a receipt for the lugguage they are holding for me. He actually forgot to pass me the receipt.   Room is clean and quiet. But it is a little small. I had only 1 small carry on lugguage and a back pack. So it wasn’t too bad. If there were 2 guests in the room with 2 lugguages it would be cramp with little space for movement.   The bathroom has a good open view although you should draw down the blinds for privacy as it faces various buildings nearby.   Location of the hotel is great. Next to various shopping malls with lots…,30,Feb-20,Undisclosed,74,66
Excellent in every way,"I spent 6 nights here and could have stayed for many more. I was travelling solo, and had a double room but I paid extra for the view. Would highly recommended paying extra for the view, as it just added another element to enjoy. The room was compact but had everything I needed, and as a solo traveller I felt really safe. The location was extremely convenient, particularly in regards to how close the hotel is to Orchard mrt. The only thing I'd mention, while not an issue, was that the bed is made of something like memory foam, which tended to stay moulded in the shape of my body while sleeping - something that could be an issue if you are needing more back support. I found the bed very comfortable though overall and the layout of the room to be very well organised. The staff…",50,Feb-20,Undisclosed,2,4
No Breakfast robot... ((((,"During this stay, I was disappointed that the hotel took out one of the main point of the Yotel Singapore experience - the breakfast robot they had in November last year! Bring back the breakfast robot, please!",40,Feb-20,Undisclosed,1,2
Not worth it,Not worth the money. For the same price you can definitely find a hotel that has better value for money. It was quite disappointing considering how many good reviews the hotel has received. Definitely will not be staying here again.,20,Feb-20,Undisclosed,1,2
Excellent stay,"Perfect location for Orchard road, MRT, and walking to Botanic gardens. Short metro ride down to Maria Bay Area. Used Grab taxi app also and cars arrived within 2-3 mins every time.  Room was excellent, this way my first Yotel Stay.. bed was very comfortable and could tilt for TV and to create a little more floor space.  Tea and coffee stuff in room, safe and open hanging space..   Everything was compact but true LT functional. I have staying in many of the best hotels in singapore but would recommend the Yotel for a short stay if it is function you are after.  Breakfast was incl free for booking direct and I took the option for $8 per day bar allowance for not having the room serviced!!   Great ideas, staff very friendly, love the robots... I would stay again. ",50,Feb-20,Undisclosed,136,66
NICE HOTEL,"staffs are friendly and helpful although the room was quite small, it was tidy and clean (and we love it!!!!) overall it was impressive our stay was enjoyable, will absolutely book again once we come singapore!!",40,Feb-20,Undisclosed,1,2
How could you ever beat this!!!,"Yotel is clean, inexpensive (join their club for free for better rates, too), it’s actually in Jewel within the airport so very safe and in the middle of the attractions. You can check your bags on the first floor up to three hours ahead of departure so I checked them in the day before. They even have robots which will bring drinks to your room. So cool!!",50,Feb-20,Undisclosed,94,63
A nice stay overall!,"Comfortable, clean and futuristic hotel in central place in Singapore. MRT station and many eating options nearby. Rooms are smallish but functional, swimming pool nice, staff are friendly and helpful.",50,Feb-20,Undisclosed,5,9
A good Hotel for City trips,A nice Hotel with a modern Style. The breakfast was excellent with very much Choice of good food.The coffee was perfekt. We like the modern feeling in this Hotel. We want to recommend it. The war to the Orachad Road und to MRT are very Short.,40,Feb-20,Undisclosed,1,2
