Value for money,"Firstly, they do offer early check in as early as 7am even though my check in timing was 3pm, at no extra cost or early check out.  The breakfast had so many different things on the plate, no one could ever finish that much for breakfast. ",50,Feb-22,Undisclosed,1,0
Amazing stay," Location is super good. Even though room is a bit small as it mentioned as cabin, other than that It’s all excellent. Cleanliness, Wifi, my cabin location, all are excellent. I love my stay in this Hotel. Well done!",50,Feb-22,Undisclosed,49,17
YOTEL Staycay Review,Staycay at YOTEL was nice but the rooms are really small. Pool is not open 24/7 so do check out the opening and closing hours.Would also be great if the rooms had a table big enough for laptops and had electrical sockets near the bed for charging purposes. There was only one electrical socket next to the bed which was for the kettle. ,30,Feb-22,Undisclosed,1,0
Great stay!,"Overall amazing stay. Kids love the bulked bed. Remote control bed is really comfortable. Shampoo, conditioner, body wash, body lotion and hand wash all available. Iron and hair dryer are available as well. Small and essential are all there!",50,Feb-22,Undisclosed,2,0
Futuristic and minimal hotel,"Great utilisation of space, very sufficient and comfortable despite the size of the room. Check in was a breeze, accessibility to main orchard strip was fully sheltered. Would go again for a short getaway. This is not a luxurious experience, but a nice stay in central location away from home.",40,Feb-22,Undisclosed,1,0
Restful Solo Staycation in the Heart of Town,Have stayed with YOTEL at JEWEL last year and enjoyed the cabin. Hence decided to check out YOTEL at Orchard to have a same-same but different experience of rest ☺️ No regrets!   I liked how YOTEL is well-connected- to the malls nearby as well as the MRT station.,40,Feb-22,Undisclosed,1,0
Bad sleeping experience,"The mission control team was very nice, the offered me early check in in one day advance. It is a ideal location for tourists. But I’m not satisfied with the sleeping experience, the bed was too soft and it becomes a big pit after whole night sleeping, also the door moves when the some one closes the other rooms door ",30,Feb-22,Undisclosed,1,0
Bad experience !,"Total bad experience with yotel and it's our first time staying there to celebrate 2 birthdays. First the super unfriendly manager on duty on 1 Feb was so unprofessional. Came up to our room, called us again in the room, and even got a lady from housekeeping to call us to warn us and wanted to chase us out of hotel. Disappointed. Will share this bad experience with everyone and social media.",10,Feb-22,Undisclosed,1,0
1 night staycation,"It was great for a one night staycation. The location of the hotel is good and has a 24 hour cafe just next to hotel if you feel hungry in the middle of the night. One bad thing is that the ""smart"" TV does not come with inbuilt streaming apps such as Netflix. ",40,Feb-22,Undisclosed,1,0
Fun StayCay 2022,Amazing hotel with trendy and hip interior room design !!! Although room size are quite small but still value for the price of one night stay. Overrall still ok for me and family as our is connecting room.  ,40,Jan-22,Undisclosed,1,0
Average,"Nice room but small .Bed is super comfy and nice to sleep indeed!! The check in and check out are smooth .The food not much option .Swimming pool is too small.And the most sad part is the breakfast.Not much variety and  i request to pack a nasi lemak that comes with just a rice ,chilli,egg ,anchovies peanut and a tiny small piece of otah! Not even a chicken wing to go with! The rice smells good but was half cooked😔.",30,Feb-22,Undisclosed,1,0
Staycation at Yotel Orchard Road,"The queue was long during check in. But it was a fast check in due to the efficiency of the staffs, They were friendly and ready to help. The bed was comfy. I had a good 8 hours sleep. Location was great. it was easy to find food around the vicinity. ",50,Feb-22,Undisclosed,1,0
Staycation with Nelfix Marathon,Great. With Samsung Smart TV. Need to book gym and pool asap after check in. Staff who habdle the booking may also book the slot so need to reconfirm. Breakfast option has 3 selections. You can choose 1 cold and 1 hot drink. ,40,Feb-22,Undisclosed,2,0
Auuwwsome,"Fully satisfy except for the bed, too soft for me. Location matters as it’s nearby my work place. Hopefully there is a 24hrs cafe in near future. Unfortunately unable to use the swimming pool and breakfast at the cafe due to timing given as I understand very well on the SOP.",50,Feb-22,Undisclosed,1,0
As good as expected.,"I love its convenient location with lots of options to dine or shop, and the early check-in offered was great, though I did not try to ask for it outfront. The room was also well equipped and able to cast your smartphone's screen on the smart tv. I would recommend others to try the hotel if you want to do a staycation in Orchard area.",50,Jan-22,Undisclosed,117,48
Yotel Staycation,Have free breakfast but cannot eat because they cater only for non-muslim. Room very cramped and the bed need to change the mattress because the firmness is gone. I wish they can cater food for muslim in near future.,30,Jan-22,Undisclosed,1,0
Relaxing and comfy stay,"If you are looking for a comfortable yet affordable hotel for a weekend staycation, YOTEL is a great choice. The amenities available are great too! Hotel located near malls as well and there are many food options to choose from. Definitely recommended",50,Jan-22,Undisclosed,1,0
CLEAN,not a bad place after all for the price and location. the environment and food there is not bad also and the room is clean as well as the amenities is also in good condition. no improvements needed ...,50,Jan-22,Travelled as a couple,1,0
Cosy Getaway,Small pool and minimum gym for a basic workout. Set back is that there is no complimentary carpark for staying guests and overnight parking is not cheap. So it added to the cost of stay after which is not really a value for money hotel.,40,Jan-22,Undisclosed,1,0
Great experience,Would recommend others for this hotel! Super cool & nice view! Not far from the MRT & many places can go for sight seeing.. Most importantly there is bidet in the toilet.. cool design & cool swimming pool view..,50,Jan-22,Undisclosed,1,0
Big thank you to Conrad + Birthday Celebrations,"A big thank you to Conrad for arranging the birthday staycation for my family member. 4th stay since 2021, having few more upcoming. Booked the bunk bed room, allocated to level 29. Below is my review of the hotel room:  Lobby +Staff are friendly +Safe distancing and temperature taking is enforced by staff Note that deposit of $50 is required for the stay. House keeping only make up room 4 days once. Have some difficulties when staying there for 2 nights. Firstly, have to go to level 1 reception to change the card. Secondly, have to call the housekeeping to change the towel and empty the bins for us. Since the house keeping didn't come in, we left the bin and towel outside our room.  +6 lifts , lift goes fast and readily  Room +Room decorated with the BIRTHDAY wording +Room…",40,Jan-22,Undisclosed,269,0
Interesting concept,"Small and cozy room for 2 people. Toilet was spacious. Bed was comfy, had a really nice sleep after shopping in town. Room service was fast too even though we called late at night. Due to safe distancing restrictions, please remember to reserve gym and pool slots early at level 10.",50,Jan-22,Undisclosed,1,0
Friendly stuff and good cabin,Good cabin and nice aircon. Great service from stuff and no problems for everything during check in. Was very pleased to being checking in to this hotel yotel. Would come again for any events for couples.,50,Jan-22,Undisclosed,1,0
Great service and comfortable stay!,"Was recommended by my friend and did thought of trying out to use for the rediscovery voucher. Stayed with my bf, overall enjoyed our stay. Comfortable and clean, food was good. Really worth the stay! ",40,Jan-22,Undisclosed,2,0
Yotel room comfort,"Had the best sleep in a while!. Great beds, superior comfort. Great scenic view and well maintained hotel amenities (gym and pool). Location was ok. Supplies were adequate for the duration of the stay. Keep it up, Yotel Singapore!  ",40,Jan-22,Undisclosed,1,0
Like a Prison Cell,"Very small rooms(14sqm) wihout a window, nested with bathroom. So the room is always moist. If you dont lift the bed, you can not move in the room. There is no closed wardrop. On the other hand, there is iron, iron desk, kettle, umbrella etc.",20,Jan-22,Travelled on business,10,4
Cool hotel,Comfortable and clean. Great location walking distance to many nice restaurants and shopping centres. The view was very nice from the room. Bed was comfortable and staff were friendly. Would go back again. ,50,Jan-22,Undisclosed,1,0
Value for money! Recommended,"This is the first time we have stayed here and thoroughly enjoyed it. Reasonable price, socially responsible, fantastic location. Staff really friendly and helpful. They were extremely accommodating and allowed us to check out late at 11:30am. The amenities were great. The room was small but wonderful, clean, and perfect to celebrate my husband’s birthday weekend. They even prepared a birthday card with their signatures and a bag of macaroons.",40,Jan-22,Travelled as a couple,74,31
great stay,great stay!!! bed was comfy the view is amazing ! cant wait to be back again because it’s definitely one of my favourite hotels now :) the bar is great too!! enjoyed the stay pretty muchhh! will definitely be back for more,50,Jan-22,Undisclosed,1,0
Staycation at Yotel,"Cool hotel, the room is small but cozy.  Cabin was clean and view was good Early check in was allowed. Staff was friendly and helpful. Location was good and value for money. Will be back again for another staycation. ",50,Feb-21,Undisclosed,1,0
RECCOMEND !,"Pros: Great location in orchard.  High floor & Nice New room.  Loved the full clear view from toilet.  Nice adjustable incline bed, great for tv.  Cons : pillows are too soft & no cottonbuds in room. policy checkin 3pm but checkout 11am, is far too early for me.  requested for a late checkout but only given to 11.30am instead. Disappointed.   Premium Queen Room :  Still a good night stay, will be back again, Recommend.",50,Jan-22,Undisclosed,4,0
Clean and Fancy Hotel,"Great hotel, very easy to find and in a good location. Love the design and aesthetic of the hotel. Got the higher floor room which was nice and the room came with a good view. Staff was helpful and polite.",50,Jan-22,Undisclosed,5,0
Good Stay,"It was at a good location, easily accessible to all the shopping malls, but was quite hard to find at the start. The room was comfortable and the amenities was good too. Bought food to eat, but had some difficulties as there was no table. But overall it was a good stay, and would visit again. ",40,Jan-22,Undisclosed,1,0
Great staycation spot!,"The hotel is a comfortable size, with great amenities around the area. You can get everything around you, which makes YOTEL Orchard a great place to stay at! Not only that, you get a decent sized room to rest in, and catch up on some of your shows! It's convenient to plug in your HDMI cable to your phone/iPad and catch Disney+ or Netflix on too. ",40,Jan-22,Undisclosed,1,0
Value: 9/10 Cleanliness: 10/10 Service: 8/10 Convenience: 9/10 Overall: 9/10,"Convenience: The location is very convenient as it is only about 5-6 minutes away from the MRT. However, it may be hard to find and some people may need to go the long way around. Carpark was not complimentary, so fellow drivers please consider.   Cleanliness: Not much watermarks, fingerprints and stains found on the room   Amenities: Didn’t really go down to utilise the gym or pool as both were next to the restaurant and not that big. Room size was cozy for 2 pax max if it was just the premium queen, however 3 or more would be slightly small  Overall: It was a great experience, perfect for couples or singles but not recommended for families",50,Jan-22,Undisclosed,1,0
Staycation for Parents,"Overall was a good experience, except that the bed was too soft for us. Good location for those who wants to be near the city but still get to enjoy the peace and quiet of the suburbs. Plenty of good food choices around the hotel.",50,Jan-22,Undisclosed,2,0
Yotel Orchard Singapore,It was a very fun experience for me and my friends! We really enjoyed our stay in Yotel. Price was very affordable which already includes breakfast. Staff were very friendly too!😊 Will surely recommend to family and friends👍👍,50,Jan-22,Undisclosed,1,0
Staycation,I only have with bed. It tend to slides at the end. I difficulty adjusting it. That it is the only problem. The rest is fantastic. The location of the hotel is good. There is many mall and eating place. Easy public transportation.,50,Jan-22,Undisclosed,1,0
"Ideal for ""ME"" time!","Decided to isolate while waiting for PCR test taken upon arrival. Just got off a turbulent 7ish hour flight, it was 2am-ish, tired, hungry...mind wasn't in the best condition. Therefore, really appreciated the comfort of the bed. The staff was very friendly, patient and empathetic. Location was perfect in terms of easy access to food and retail AND protection from the rain! I would definitely return! PS: Perfect place for ""ME time""!",50,Dec-21,Undisclosed,8,0
"Cozy, clean rooms, superb staff, nice view in a great location with lots of shopping and good eateries","Finally found a 3 bedder where we could spend some time with our teenage boy. We knew the room will be smaller than most hotels but thought to give it a try. A great surprise indeed. A swift and early check in at 9am by a very friendly and helpful female staff. Room is so well kept and clean, with everything you need. Super view from our room on the 27th floor. Will book soon for another family day :)",50,Jan-22,Undisclosed,48,46
Cool rooms and view of the city,"Everything was in order and smooth, managed to avoid the long check in queue. Easy to find the hotel, may be confusing for first timers. Wished there was late check out too, was still asleep at 11am. Otherwise service was good and efficient. ",40,Jan-22,Undisclosed,12,3
Great,"Fas check in. Staff was very friendly. Despite spilling drinks at the hotel lobby staff immediately called the housekeeper and said its okay , no worries. They noted is my husband birthday, they gave him a pack for macaron and wish him happy birthday. Didnt manage to get his name. Thank you for serving us!",40,Jan-22,Undisclosed,1,0
Good service,"Nice hotel, room was small though. Liked the toiletries. TV was big enough. The food was so-so. Cocktail and coffee were great. Breakfast was good but not buffet style. Did not go to the gym and swimming pool",40,Jan-22,Undisclosed,1,0
Excellent stay!,"Honestly, i had to clear my SRV but im glad i chose the right staycay to spend a night there. Location was easy to find as i took the bus there. I would go for another trip here and try out the facilities that did not booked for. Overall, it was a good day to getaway👏🏻",50,Jan-22,Undisclosed,1,0
Yotel review,"Nice funky hotel theme.  Healthy small bites breakfast Like the cocktails offer,  polite and helpful staff. Very central location,  very comfy high tech bed with enough pillows. Double blinds are good for diff purposes",40,Jan-22,Travelled on business,1,0
Wonderful Trip Overall,"Hotel's location is easy to find at Orchard Road area. Near to shopping centres, convenient stores and MRT station. Staffs are very polite, the corridor is nice and the room is quite ok for me. I did not have any breakfast or any dinner in hotel. Need to register beforehand to get into the swimming pool or gym. Swimming pool water is very cold and so windy such that my clothes fly away but luckily it did not fly so far. I used the Singapore Rediscover Voucher (SRV) to book hotel and overall is wonderful trip for myself.",50,Jan-22,Travelled solo,3,0
Excellent!,"It’s a last minute decision for staycation. The price is right, booked in the morning, check-in in the afternoon. The room is super clean and the BED IS SO COMFY ! I’m definitely gonna stay again! Keep up the good job, Yotel!",50,Dec-21,Undisclosed,10,2
Wonderful stay overall,"I stayed for one night. Good location at Orchard Road, near shopping centres, convenient stores and MRT stations. Staffs are polite and friendly plus the corridor and the room inside are great. Swimming pool is wonderful just that it is too cold and too windy and my clothes almost flew away. I did not have breakfast and dinner on there but is good overall.",50,Jan-22,Travelled solo,1,0
"Great location, room is not spacious. not vegan friendly.","1 great WiFi 2 great service & friendly staff 3 food options for breakfast are very limited 4 corners of room is a bit dusty 5 relatively quiet, good to rest & work inside the room. 6 the basic room can be a bit too small for 2 people. for 1 person, it is just okay 7 bed is comfortable, but bed sheets can be more cleaner with fresh out of the laundry smell. ",40,Jan-22,Undisclosed,2,0
A night stay at Yotel Singapore,"Hotel concept was cool. Cabin was clean, with basic necessities provided. Love for the bidet in the toilet. 2 shower heads, water temperature was easy to adjust. Has a lot of TV channels. Staffs that attended to us were friendly. ",40,Jan-22,Undisclosed,1,0
Very clean hotel,The hotel is very clean and the location is very convenient. I feel like the room is very small and the check out time is 11am and it too early. I hope that the hotel can change the check out time to 12pm instead of 11am. Thank you.,30,Jan-22,Undisclosed,1,0
3D2N weekday stay,"Easy to find, check in was fuss-free as I went there around 3.30pm. Although the room was quite small, but its comfortable enough for 1-2pax. Friendly staff and the pool was simple and nice. Went to their bar to have a drink and they have promos on weekdays.",50,Jan-22,Undisclosed,1,0
Singapore Discovery Voucher Staycation,"Overall good staycation experience, it is good for those persons whose just need a room to sleep, or suitable for family with kids, can book for their pool.  Suggestion : don't forget to bring along your iPad, laptop in case you need to surf the internet or watch YouTube.",40,Jan-22,Undisclosed,1,0
Best Vacation Ever,Great Vacation for a Short Staycation. Happy with the hotel service and staff. Although its a small room for 3 adults but the room is enough to move about and very cosy. Will definitely be back to staycation again. Hope to have complimentary parking for vehicle during the staycation.,50,Jan-22,Undisclosed,1,0
Returning guests & will keep returning,Very convenient location.  Live the futuristic look & feel.  Very clean & great customer service.  Not forgetting the friendly neighbourhood robots - Yoshi & Yolanda - who will deliver your requests to your room,50,Jan-22,Undisclosed,1,0
Excellent service,"Staff is so friendly accommodating and pleasant. Clean & beautiful hotel, in room & also lobby. But abit too small for family of 2 toddler. But would be great for couple. Location is perfect! Near shopping & food",50,Jan-22,Undisclosed,1,0
Average stay,"Average stay, had moths in the balcony and room was quite small. Bed was too soft that i felt like i was sinking in though the bed is adjustable. Cable TV channels were available and easy to javigate through channels. Friendly staff. Overall it was a average stay.",30,Jan-22,Undisclosed,1,0
Superb location and value for money,"The location is very convient as it is right besides Shaw House. Value for money with such good location. The room is very small though, for a couple it's pretty cozy. However there's a very strong moldy smell, blow right at us the moment we open the door. It takes some time to get used to the smell.",30,Jan-22,Undisclosed,7,0
Value-for-money experience,"The room had a decent view especially since it was very high up. It also felt spacious although it was small. The rainforest shower was therapeutic. We used the rediscover voucher which included room, facilities and free breakfasts, so overall, a very worth experience! ",40,Jan-22,Undisclosed,1,0
Exciting, I really love the design for the room with bunk... Even it's small but really looked stunning. The toilet design also very good looking like a 5-star & above hotel. The staff are so friendly & helpful. ,50,Jan-22,Undisclosed,2,0
Staycation at Yotel,"One of the best hotels located in Orchard area, good amenities. Stayed here for the 5th time and still loving this place. The staff were very friendly and check in/check out process was quick and fast.",50,Jan-22,Undisclosed,1,0
Great I recommend,It was great! It was close bye the stations and transportation which made life easier. The pool was great! overall I enjoyed the experience and the view. Also the gym is nice and room service was fast and nice ,50,Dec-21,Undisclosed,2,0
Staycation @ Yotel Orchard,Our first time stay at Yotel really amaze all of us. My boys were very excited upon check in the cabin...it was like outerspace. Thank you Yotel our 1 night stay there was awesome and the food was really nice.,50,Jan-22,Undisclosed,1,0
limited  Breakfast  selection,Please  have more variety  food for breakfast. Overall expectation  is generally  good even though  the room is small .Waiting time to check-in is fast.Staff is friendly. Location is good. Fantastic  view when you get to stay higher  floor.,40,Dec-21,Undisclosed,1,0
Great,The room was great for a solo staycay. Location was convenient. Staff were generally friendly. Would come back again for a staycation in the future. The price is alright for what you get. Would recommend.,40,Jan-22,Undisclosed,1,0
Yotel,Not bad stay but room was small. Breakfast is good too! I love the body gel smells very nice! Check in is very smooth too. But air con is not cold enough although we already adjusted to 21 degree celcius,50,Dec-21,Undisclosed,1,0
Better options elsewhere for sure,"Not a fan of writing reviews, but this 4-star hotel experience has really fallen so short that I feel it’s important for everyone who’s considering to stay in Yotel to know. It’s the worst hotel I’ve stayed in, comparable to a 2.5 star hotel service experience. Paid $300 for 1 night at Deluxe Room. The price surge is due to peak / festive booking. Breakfast for 2 pax is included. 31 Dec 2021 1. Check-in is stated at 3pm and we were given the room at 6.30pm. To make the wait “feel better”, we were given complimentary drinks voucher to wait at the cozy restaurant and bar. Around 6pm, I asked the reception if there will be a free room upgrade or at least late check out to be arranged. Did not expect a 4-star hotel staff to reply defensively. He said: We are sorry for your wait, but…",10,Dec-21,Undisclosed,4,0
"Good location, clean cabin","Great location at good price, clean place. The shower facilities were great. Room is a bit small but it has great channels, with HBO and etc. The bed is too soft, such that we sunk in them. But it’s cool that it can be adjusted. ",40,Dec-21,Undisclosed,1,0
Convenient for a short stay,"Great for a short stay however bed was too soft to keep sitting on. Will cause backaches if you aren't use to soft beds. However, service from the crew is great and everyone is ever ready to help and are very polite as well despite being on a busy weekend. ",40,Dec-21,Undisclosed,2,0
New year eve staycation,This was a booking for new year eve staycation. Sadly didnt see any fireworks from my level. Overall quite okay as the check in process was smooth. Check out was okay too. Room is clean too. Just that the room is small. And the location of the hotel requires a distance to walk from the mrt,30,Dec-21,Undisclosed,1,0
pleasant stay,"clean small room with functional layout. At heart of orchard. We like the bed is adjustable like hospital bed concept. However the bed abit too soft for our liking. Location is excellent, at the shopping belt of Orchard Road.",40,Dec-21,Undisclosed,7,0
"Good view, Bad Beds","Good views and full length window. Really soft and uneven beds. Need to prep to queue outside of hotel for the check in, and then wait once checked in for your rooms to be ready as they were disinfecting it.",40,Dec-21,Undisclosed,1,0
Staycation,"Room was very small, however bed was comfortable, Check in at 3plus on the eve of New Year, 31.12.21  At check in even though is a long queue but check in process was fast, staff that check us in was friendly and efficient. On the day of check out call the receptionist at 1025hrs to request a late check out but was denied, a lady answered the call mention the hotel is running 100% occupancy which I understand just need a bit of time, told her that I need some to pack so request maybe 30mins delay. She sound unhappy and mention that if check out later than 1130 will be charged she sounds threatening though, I'm a hotelier for a decade but we were trained  to speaks in a mannerly way towards our paying guest, If you were asking me if i were to stay here again, the answer was…",20,Dec-21,Travelled as a couple,7,6
Highly recommended,A lovely hotel with many friendly & helpful staff.  Especially Aaron who is assisting me with my check-in.  Great customer service!!  Good location with many shopping malls and restaurants around.  I would definitely come back and stay longer in my next visit.  ,50,Dec-21,Undisclosed,3,0
